,doi,url,title,abstract,is_biomimicry,petal_id
177,10.1073/pnas.1620612114,https://www.semanticscholar.org/paper/83076c6a39ea48486f5a9fa78b9a0065da77f1d4,Investigation of hindwing folding in ladybird beetles by artificial elytron transplantation and microcomputed tomography,"Significance Hindwings in ladybird beetles successfully achieve compatibility between the deformability (instability) required for wing folding and strength property (stability) required for flying. This study demonstrates how ladybird beetles address these two conflicting requirements by an unprecedented technique using artificial wings. Our results, which clarify the detailed wing-folding process and reveal the supporting structures, provide indispensable initial knowledge for revealing this naturally evolved optimization system. Investigating the characteristics in the venations and crease patterns revealed in this study could provide an innovative designing method, enabling the integration of structural stability and deformability, and thus could have a considerable impact on engineering science. Ladybird beetles are high-mobility insects and explore broad areas by switching between walking and flying. Their excellent wing transformation systems enabling this lifestyle are expected to provide large potential for engineering applications. However, the mechanism behind the folding of their hindwings remains unclear. The reason is that ladybird beetles close the elytra ahead of wing folding, preventing the observation of detailed processes occurring under the elytra. In the present study, artificial transparent elytra were transplanted on living ladybird beetles, thereby enabling us to observe the detailed wing-folding processes. The result revealed that in addition to the abdominal movements mentioned in previous studies, the edge and ventral surface of the elytra, as well as characteristic shaped veins, play important roles in wing folding. The structures of the wing frames enabling this folding process and detailed 3D shape of the hindwing were investigated using microcomputed tomography. The results showed that the tape spring-like elastic frame plays an important role in the wing transformation mechanism. Compared with other beetles, hindwings in ladybird beetles are characterized by two seemingly incompatible properties: (i) the wing rigidity with relatively thick veins and (ii) the compactness in stored shapes with complex crease patterns. The detailed wing-folding process revealed in this study is expected to facilitate understanding of the naturally optimized system in this excellent deployable structure.",True,
178,10.1093/aob/mcaa058,https://www.semanticscholar.org/paper/ffe65f1cf0a1bfec30ba7727ed4b2348ad0af5aa,Pollen adaptation to ant pollination: a case study from the Proteaceae,"Background and Aims Ant–plant associations are widely diverse and distributed throughout the world, leading to antagonistic and/or mutualistic interactions. Ant pollination is a rare mutualistic association and reports of ants as effective pollinators are limited to a few studies. Conospermum (Proteaceae) is an insect-pollinated genus well represented in the south-western Australia biodiversity hotspot, and here we aimed to evaluate the role of ants as pollinators of C. undulatum. Methods Pollen germination after contact with several species of ants and bees was tested for C. undulatum and five co-flowering species for comparison. We then sampled the pollen load of floral visitors of C. undulatum to assess whether ants carried a pollen load sufficient to enable pollination. Lastly, we performed exclusion treatments to assess the relative effect of flying- and non-flying-invertebrate floral visitors on the reproduction of C. undulatum. For this, we measured the seed set under different conditions: ants exclusion, flying-insects exclusion and control. Key Results Pollen of C. undulatum, along with the other Conospermum species, had a germination rate after contact with ants of ~80 % which did not differ from the effect of bees; in contrast, the other plant species tested showed a drop in the germination rate to ~10 % following ant treatments. Although ants were generalist visitors, they carried a pollen load with 68–86 % of suitable grains. Moreover, ants significantly contributed to the seed set of C. undulatum. Conclusions Our study highlights the complexity of ant–flower interactions and suggests that generalizations neglecting the importance of ants as pollinators cannot be made. Conospermum undulatum has evolved pollen with resistance to the negative effect of ant secretions on pollen grains, with ants providing effective pollination services to this threatened species.",True,
179,10.1126/science.abb0064,https://www.semanticscholar.org/paper/73fe4831eacf867b64ca06e46131803837b5ff98,Drones become even more insect-like,"Mosquitoes' exceptional sensitivity to sound and airflow inspires new collision avoidance technology Evolutionary pressures in the animal kingdom have, over the course of several hundred million years, produced a diverse array of creatures highly adapted to survival within their own niche environments. Such adaptations coincide with optimized and efficient materials, body structure, and behavior. Humans have long drawn inspiration from nature in the creation of new technologies—for example, the earliest attempts at flight based on emulation of birds—and many benefits stem from the study of processes, materials, methods, and organizational structures of living organisms. On page 634 of this issue, Nakata et al. (1) exemplify the bioinspired design methodology through their investigation of the sound- and airflow-sensing capabilities of the southern house mosquito Culex quinquefasciatus and subsequent creation of a small quad-copter drone with an autonomous collision avoidance system based on the same sensing principles. The sensor displays compelling advantages in weight, power, and deployability over existing technology.",True,
180,10.1098/rspb.2020.0457,https://www.semanticscholar.org/paper/e4f75c6562ec3c60efe38478ca256b2f24bafec3,Deciphering an extreme morphology: bone microarchitecture of the hero shrew backbone (Soricidae: Scutisorex),"Biological structures with extreme morphologies are puzzling because they often lack obvious functions and stymie comparisons to homologous or analogous features with more typical shapes. An example of such an extreme morphotype is the uniquely modified vertebral column of the hero shrew Scutisorex, which features numerous accessory intervertebral articulations and massively expanded transverse processes. The function of these vertebral structures is unknown, and it is difficult to meaningfully compare them to vertebrae from animals with known behavioural patterns and spinal adaptations. Here, we use trabecular bone architecture of vertebral centra and quantitative external vertebral morphology to elucidate the forces that may act on the spine of Scutisorex and that of another large shrew with unmodified vertebrae (Crocidura goliath). X-ray micro-computed tomography (µCT) scans of thoracolumbar columns show that Scutisorex thori is structurally intermediate between C. goliath and S. somereni internally and externally, and both Scutisorex species exhibit trabecular bone characteristics indicative of higher in vivo axial compressive loads than C. goliath. Under compressive load, Scutisorex vertebral morphology is adapted to largely restrict bending to the sagittal plane (flexion). Although these findings do not solve the mystery of how Scutisorex uses its byzantine spine in vivo, our work suggests potentially fruitful new avenues of investigation for learning more about the function of this perplexing structure.",True,
181,10.1017/S0368393100109915,https://www.semanticscholar.org/paper/dae7ab35a62d69ec88b586123fe171dda8276dc7,The Silent Flight of Owls,"It is possible to trace, in the flying equipment of birds, feathered versions of many of the refinements that render the modern aeroplane more efficient than its predecessors. It would, therefore, be a mistake to ignore birds as a guide to possible future developments. One of the most interesting groups of birds is that which includes all the owls, for there is a possible connection between the manner in which their strikingly silent flight is achieved and the increasingly pressing problem of silencing airscrews.",True,
183,10.1016/j.asd.2018.12.004,https://www.semanticscholar.org/paper/c86ba572887cd8d24604a53619a5ad548c5112ef,Pygidial glands of Harpalus pensylvanicus (Coleoptera: Carabidae) contain resilin-rich structures.,"The pygidial gland system is a key innovation in adephagan beetles, producing, storing, and spraying defensive chemical compounds. As the source of defensive chemical production and storage, the pygidial gland system experiences severe chemical stress which challenges the integrity of the entire gland system. Here, we utilize autofluorescence-based confocal laser scanning microscopy to examine the morphology of pygidial gland secretory lobes and collecting ductules in a common Pennsylvanian harpaline species, Harpalus pensylvanicus. The glandular units are composed of type-III exocrine cells which empty into resilin-rich ductules, which themselves lead into a larger resilin-rich collecting duct, and ultimately the pygidial reservoir pump. We also utilize histological staining with toluidine blue and brightfield imaging to provide additional support for the presence of resilin in the collecting duct, as toluidine blue has been shown to stain resilin without metachromasia. We hypothesize that the high resilin content of the collecting ducts might be a widespread key evolutionary adaptation to prevent damage caused by physical and chemical stress generated in pump-containing insect exocrine gland systems.",True,
184,10.1101/2020.08.08.238469,https://www.semanticscholar.org/paper/9d500441b4b2af7aabfd0c8704f31d6036374fca,An ultra-potent synthetic nanobody neutralizes SARS-CoV-2 by locking Spike into an inactive conformation,"Without an effective prophylactic solution, infections from SARS-CoV-2 continue to rise worldwide with devastating health and economic costs. SARS-CoV-2 gains entry into host cells via an interaction between its Spike protein and the host cell receptor angiotensin converting enzyme 2 (ACE2). Disruption of this interaction confers potent neutralization of viral entry, providing an avenue for vaccine design and for therapeutic antibodies. Here, we develop single-domain antibodies (nanobodies) that potently disrupt the interaction between the SARS-CoV-2 Spike and ACE2. By screening a yeast surface-displayed library of synthetic nanobody sequences, we identified a panel of nanobodies that bind to multiple epitopes on Spike and block ACE2 interaction via two distinct mechanisms. Cryogenic electron microscopy (cryo-EM) revealed that one exceptionally stable nanobody, Nb6, binds Spike in a fully inactive conformation with its receptor binding domains (RBDs) locked into their inaccessible down-state, incapable of binding ACE2. Affinity maturation and structure-guided design of multivalency yielded a trivalent nanobody, mNb6-tri, with femtomolar affinity for SARS-CoV-2 Spike and picomolar neutralization of SARS-CoV-2 infection. mNb6-tri retains stability and function after aerosolization, lyophilization, and heat treatment. These properties may enable aerosol-mediated delivery of this potent neutralizer directly to the airway epithelia, promising to yield a widely deployable, patient-friendly prophylactic and/or early infection therapeutic agent to stem the worst pandemic in a century.",True,
185,10.1088/1748-3182/7/3/036014,https://www.semanticscholar.org/paper/8eca9e96ab03909f587672f558380190261412f8,Locomotion of Mexican jumping beans.,"The Mexican jumping bean, Laspeyresia saltitans, consists of a hollow seed housing a moth larva. Heating by the sun induces movements by the larva which appear as rolls, jumps and flips by the bean. In this combined experimental, numerical and robotic study, we investigate this unique means of rolling locomotion. Time-lapse videography is used to record bean trajectories across a series of terrain types, including one-dimensional channels and planar surfaces of varying inclination. We find that the shell encumbers the larva's locomotion, decreasing its speed on flat surfaces by threefold. We also observe that the two-dimensional search algorithm of the bean resembles the run-and-tumble search of bacteria. We test this search algorithm using both an agent-based simulation and a wheeled Scribbler robot. The algorithm succeeds in propelling the robot away from regions of high temperature and may have application in biomimetic micro-scale navigation systems.",True,
186,10.1016/j.jtbi.2017.09.017,https://www.semanticscholar.org/paper/ef70c2ad1ba97a0cbbe8644b5ba831dbba38e323,Optimal construction of army ant living bridges.,"Integrating the costs and benefits of collective behaviors is a fundamental challenge to understanding the evolution of group living. These costs and benefits can rarely be quantified simultaneously due to the complexity of the interactions within the group, or even compared to each other because of the absence of common metrics between them. The construction of 'living bridges' by New World army ants - which they use to shorten their foraging trails - is a unique example of a collective behavior where costs and benefits have been experimentally measured and related to each other. As a result, it is possible to make quantitative predictions about when and how the behavior will be observed. In this paper, we extend a previous mathematical model of these costs and benefits to much broader domain of applicability. Specifically, we exhibit a procedure for analyzing the optimal formation, and final configuration, of army ant living bridges given a means to express the geometrical configuration of foraging path obstructions. Using this procedure, we provide experimentally testable predictions of the final bridge position, as well as the optimal formation process for certain cases, for a wide range of scenarios, which more closely resemble common terrain obstacles that ants encounter in nature. As such, our framework offers a rare benchmark for determining the evolutionary pressures governing the evolution of a naturally occurring collective animal behavior.",True,
187,10.1088/1748-3190/aba8ac,https://www.semanticscholar.org/paper/5a8f0be8388c0f85a2dd90ef566726961f67cf78,Aerodynamic performance of flexible flapping wings deformed by slack angle.,"Wing flexibility is unavoidable for flapping wing flyers to ensure a lightweight body and for higher payload allowances on board. It also effectively minimizes the inertia force from high-frequency wingbeat motion. However, related studies that attempt to clarify the essence of wing flexibility remain insufficient. Here, a parametric study of a flexible wing was conducted as part of the effort to build an aerodynamic model and analyze its aerodynamic performance. The Quasi-steady (QS) modelling was adopted with experimentally determined translational forces. These forces were determined from 84 flexible wing cases while varying the angle of attack at the wing root and the flexibility parameter, slack angle , with 19 additional rigid wing cases. This study found for optimum lift generation to exceed 45° irrespective of . The coefficient curves were well-fitted with a cubed-sine function. The model was rigorously validated with various wing kinematics, giving a good estimation of the experimental results. The estimated error was less than 5%, 6%, and 8% for the lift, drag, and moment, respectively, considering fast to moderate wing kinematics. The study was extended to analyze the pure aerodynamic performance of the flexible wing. The most suitable wing for a flapping-wing micro-aerial vehicle (FWMAV) wing design with a simple vein structure was found to be the 5° slack-angled wing. The inference from this study further shows that a small amount of deformation is needed to increase the lift, as observed in natural flyers. Thus, wing deformation could allow living flyers to undertake less pitching motion in order to reduce the mechanical power and increase the efficiency of their wings.",True,
188,10.1098/rspb.2020.1748,https://www.semanticscholar.org/paper/bac416d379a2e7ea49ea9a7538810b86bd4b74e5,Bird wings act as a suspension system that rejects gusts,"Musculoskeletal systems cope with many environmental perturbations without neurological control. These passive preflex responses aid animals to move swiftly through complex terrain. Whether preflexes play a substantial role in animal flight is uncertain. We investigated how birds cope with gusty environments and found that their wings can act as a suspension system, reducing the effects of vertical gusts by elevating rapidly about the shoulder. This preflex mechanism rejected the gust impulse through inertial effects, diminishing the predicted impulse to the torso and head by 32% over the first 80 ms, before aerodynamic mechanisms took effect. For each wing, the centre of aerodynamic loading aligns with the centre of percussion, consistent with enhancing passive inertial gust rejection. The reduced motion of the torso in demanding conditions simplifies crucial tasks, such as landing, prey capture and visual tracking. Implementing a similar preflex mechanism in future small-scale aircraft will help to mitigate the effects of gusts and turbulence without added computational burden.",True,
189,10.1242/jeb.226654,https://www.semanticscholar.org/paper/b6f6320feea3f4619c99b9b23b6007fa1a72ef42,Remoras pick where they stick on blue whales,"Animal-borne video recordings from blue whales in the open ocean show that remoras preferentially adhere to specific regions on the surface of the whale. Using empirical and computational fluid dynamics analyses, we show that remora attachment was specific to regions of separating flow and wakes caused by surface features on the whale. Adhesion at these locations offers remoras drag reduction of up to 71–84% compared with the freestream. Remoras were observed to move freely along the surface of the whale using skimming and sliding behaviors. Skimming provided drag reduction as high as 50–72% at some locations for some remora sizes, but little to none was available in regions where few to no remoras were observed. Experimental work suggests that the Venturi effect may help remoras stay near the whale while skimming. Understanding the flow environment around a swimming blue whale will inform the placement of biosensor tags to increase attachment time for extended ecological monitoring. Highlighted Article: Analysis of previously undocumented skimming and sliding behaviors used by remoras reveals they preferentially adhere to areas with reduced drag on blue whales.",True,
190,10.1016/j.anbehav.2020.09.014,https://www.semanticscholar.org/paper/9706f3aef1d1ba2c21a2db52179bc662eb832bb1,Quadratic resource value assessment during mantis shrimp (Stomatopoda) contests,"Resource value assessment, in which competitors adjust behaviours according to the perceived value of a contested resource, is well described in animal contests. Such assessment is usually assumed to be categorical or linear; for example, males fight more aggressively when females are present than absent, or as female fecundity increases. Here, to our knowledge for the first time, we show quadratic resource value assessment, in which resource value is highest at a certain level and decreases in either direction. The mantis shrimp Neogonodactylus bredini occupies coral rubble burrows in a size-assortative manner: individuals of a certain body size inhabit burrows of a certain size. Using mock burrows of various sizes, we tested whether mantis shrimp (1) chose burrows predicted to be the best fit for their body size and (2) were more aggressive during, endured higher costs during and were more likely to win contests over burrows predicted to be best fit. Individuals chose burrows larger than their predicted best fit burrows. In contests, intruders without burrows were more likely to evict burrow residents when the burrow was slightly smaller than the intruder's predicted best fit size. Intruder success decreased as relative burrow size increased or decreased from this value. Intruders won by delivering more strikes and by being aggressive first. In contrast to intruders, burrow residents showed little evidence of resource value assessment. A literature review revealed that quadratic resource value assessment may play a role in contests over resources from territories to parasite hosts. Therefore, our results impact theoretical models of contest behaviour and may lend insight to how contests affect resource distributions.",True,
191,10.1152/physrev.00016.2016,https://www.semanticscholar.org/paper/66533aa0cc9489446b4ceec51ea656f6799c04d8,Molecular Physiology of Freeze Tolerance in Vertebrates.,"Freeze tolerance is an amazing winter survival strategy used by various amphibians and reptiles living in seasonally cold environments. These animals may spend weeks or months with up to ∼65% of their total body water frozen as extracellular ice and no physiological vital signs, and yet after thawing they return to normal life within a few hours. Two main principles of animal freeze tolerance have received much attention: the production of high concentrations of organic osmolytes (glucose, glycerol, urea among amphibians) that protect the intracellular environment, and the control of ice within the body (the first putative ice-binding protein in a frog was recently identified), but many other strategies of biochemical adaptation also contribute to freezing survival. Discussed herein are recent advances in our understanding of amphibian and reptile freeze tolerance with a focus on cell preservation strategies (chaperones, antioxidants, damage defense mechanisms), membrane transporters for water and cryoprotectants, energy metabolism, gene/protein adaptations, and the regulatory control of freeze-responsive hypometabolism at multiple levels (epigenetic regulation of DNA, microRNA action, cell signaling and transcription factor regulation, cell cycle control, and anti-apoptosis). All are providing a much more complete picture of life in the frozen state.",True,
192,10.1007/978-3-211-99749-9_1,https://www.semanticscholar.org/paper/c5083a29d8feeac63220d4b6d870c158a2672fac,Nature as model for technical sensors,"form only given. Sensors and sensing are essential for all forms of life. Correspondingly there is a fascinating richness and diversity of sensory systems throughout the animal kingdom. Animals use sensory input not only for communication, but also for the detection, discrimination and localization of animate and inanimate objects. In addition sensory systems provide basic cues for spatial orientation and navigation. Both the structure and the physiology of sensory systems reflect the natural environment in which an animal lives and the needs of the animal. Accordingly, the relevant and often complex stimuli and noise conditions, which natural sensors evolved to cope with, have to be found and applied, to fully understand any sensory system. This is a particular challenge in cases where animals show sensory capabilities alien to human perceptions. This presentation focuses on two sensory systems that humans and most animals do not have: the infrared sensory system of pyrophilous beetles and the electrosensory system of weakly electric fish. I will show that these sensory systems not only have remarkable features but can also be used as a model for the development of novel technical sensors.",True,
