,doi,url,title,abstract,is_biomimicry,petal_id
262,10.1016/j.fgb.2020.103466,https://www.semanticscholar.org/paper/f505fe7c6f6bcbb906af26485d9fad2030928607,Pseudoflowers produced by Fusarium xyrophilum on yellow-eyed grass (Xyris spp.) in Guyana: a novel floral mimicry system?,"Pseudoflower formation is arguably the rarest outcome of a plant-fungus interaction. Here we report on a novel putative floral mimicry system in which the pseudoflowers are composed entirely of fungal tissues in contrast to modified leaves documented in previous mimicry systems. Pseudoflowers on two perennial Xyris species (yellow-eyed grass, X. setigera and X. surinamensis) collected from savannas in Guyana were produced by Fusarium xyrophilum, a novel Fusarium species. These pseudoflowers mimic Xyris flowers in gross morphology and are ultraviolet reflective. Axenic cultures of F. xyrophilum produced two pigments that had fluorescence emission maxima in light ranges that trichromatic insects are sensitive to and volatiles known to attract insect pollinators. One of the volatiles emitted by F. xyrophilum cultures (i.e., 2-ethylhexanol) was also detected in the head space of X. laxifolia var. iridifolia flowers, a perennial species native to the New World. Results of microscopic and PCR analyses, combined with examination of gross morphology of the pseudoflowers, provide evidence that the fungus had established a systemic infection in both Xyris species, sterilized them and formed fungal pseudoflowers containing both mating type idiomorphs. Fusarium xyrophilum cultures also produced the auxin indole-3-acetic acid (IAA) and the cytokinin isopentenyl adenosine (iPR). Field observations revealed that pseudoflowers and Xyris flowers were both visited by bees. Together, the results suggest that F. xyrophilum pseudoflowers are a novel floral mimicry system that attracts insect pollinators, via visual and olfactory cues, into vectoring its conidia, which might facilitate outcrossing of this putatively heterothallic fungus and infection of previously uninfected plants.",True,
263,10.1016/j.jprot.2020.104083,https://www.semanticscholar.org/paper/0c01ddd3b89d8fc705588d656e768779f0e45596,Conus venom fractions inhibit the adhesion of Plasmodium falciparum erythrocyte membrane protein 1 domains to the host vascular receptors.,"Using high-throughput BioPlex assays, we determined that six fractions from the venom of Conus nux inhibit the adhesion of various recombinant PfEMP-1 protein domains (PF08_0106 CIDR1α3.1, PF11_0521 DBL2β3, and PFL0030c DBL3X and DBL5e) to their corresponding receptors (CD36, ICAM-1, and CSA, respectively). The protein domain-receptor interactions permit P. falciparum-infected erythrocytes (IE) to evade elimination in the spleen by adhering to the microvasculature in various organs including the placenta. The sequences for the main components of the fractions, determined by tandem mass spectrometry, yielded four T-superfamily conotoxins, one (CC-Loop-CC) with I-IV, II-III connectivity and three (CC-Loop-CXaaC) with a I-III, II-IV connectivity. The 3D structure for one of the latter, NuxVA = GCCPAPLTCHCVIY, revealed a novel scaffold defined by double turns forming a hairpin-like structure stabilized by the two disulfide bonds. Two other main fraction components were a miniM conotoxin, and a O2-superfamily conotoxin with cysteine framework VI/VII. This study is the first one of its kind suggesting the use of conotoxins for developing pharmacological tools for anti-adhesion adjunct therapy against malaria. Similarly, mitigation of emerging diseases like AIDS and COVID-19, can also benefit from conotoxins as inhibitors of protein-protein interactions as treatment. BIOLOGICAL SIGNIFICANCE: Among the 850+ species of cone snail species there are hundreds of thousands of diverse venom exopeptides that have been selected throughout several million years of evolution to capture prey and deter predators. They do so by targeting several surface proteins present in target excitable cells. This immense biomolecular library of conopeptides can be explored for potential use as therapeutic leads against persistent and emerging diseases affecting non-excitable systems. We aim to expand the pharmacological reach of conotoxins/conopeptides by revealing their in vitro capacity to disrupt protein-protein and protein-polysaccharide interactions that directly contribute to pathology of Plasmodium falciparum malaria. This is significant for severe forms of malaria, which might be deadly even after treated with current parasite-killing drugs because of persistent cytoadhesion of P. falciparum infected erythrocytes even when parasites within red blood cells are dead. Anti-adhesion adjunct drugs would de-sequester or prevent additional sequestration of infected erythrocytes and may significantly improve survival of malaria patients. These results provide a lead for further investigations into conotoxins and other venom peptides as potential candidates for anti-adhesion or blockade-therapies. This study is the first of its kind and it suggests that conotoxins can be developed as pharmacological tools for anti-adhesion adjunct therapy against malaria. Similarly, mitigation of emerging diseases like AIDS and COVID-19, can also benefit from conotoxins as potential inhibitors of protein-protein interactions as treatment.",True,
264,10.1073/pnas.2007815118,https://www.semanticscholar.org/paper/48c4b6fa8216067a9c0169e30a3320f3af36da35,Encoding memory in tube diameter hierarchy of living flow network,"Significance Simple organisms manage to thrive in complex environments. Having memory about the environment is key in taking informed decisions. Physarum polycephalum excels as a giant unicellular eukaryote, being even able to solve optimization problems despite the lack of a nervous system. Here, we follow experimentally the organism’s response to a nutrient source and find that memory about nutrient location is encoded in the morphology of the network-shaped organism. Our theoretical predictions in line with our observations unveil the mechanism behind memory encoding and demonstrate the P. polycephalum’s ability to read out previously stored information. The concept of memory is traditionally associated with organisms possessing a nervous system. However, even very simple organisms store information about past experiences to thrive in a complex environment—successfully exploiting nutrient sources, avoiding danger, and warding off predators. How can simple organisms encode information about their environment? We here follow how the giant unicellular slime mold Physarum polycephalum responds to a nutrient source. We find that the network-like body plan of the organism itself serves to encode the location of a nutrient source. The organism entirely consists of interlaced tubes of varying diameters. Now, we observe that these tubes grow and shrink in diameter in response to a nutrient source, thereby imprinting the nutrient’s location in the tube diameter hierarchy. Combining theoretical model and experimental data, we reveal how memory is encoded: a nutrient source locally releases a softening agent that gets transported by the cytoplasmic flows within the tubular network. Tubes receiving a lot of softening agent grow in diameter at the expense of other tubes shrinking. Thereby, the tubes’ capacities for flow-based transport get permanently upgraded toward the nutrient location, redirecting future decisions and migration. This demonstrates that nutrient location is stored in and retrieved from the networks’ tube diameter hierarchy. Our findings explain how network-forming organisms like slime molds and fungi thrive in complex environments. We here identify a flow networks’ version of associative memory—very likely of relevance for the plethora of living flow networks as well as for bioinspired design.",True,
265,10.1093/conphys/coaa120,https://www.semanticscholar.org/paper/58d010aa8831c2aa9712b669a1bc0ec63c8e2d2a,Wound-healing capabilities of whale sharks (Rhincodon typus) and implications for conservation management,"Marine species, such as the whale shark, are being subjected to unprecedented levels of human influence in their natural habitats. They may be vulnerable to obtaining injuries while spending time in surface waters. This study explores injury characteristics and timeframes of injury recovery with a view to inform management.",True,
266,10.1103/PhysRevLett.126.088003,https://www.semanticscholar.org/paper/9cf109cd269cb5d750bb1d68a230cf244f5f2fb7,Control of Helical Navigation by Three-Dimensional Flagellar Beating.,"Helical swimming is a ubiquitous strategy for motile cells to generate self-gradients for environmental sensing. The model biflagellate Chlamydomonas reinhardtii rotates at a constant 1-2 Hz as it swims, but the mechanism is unclear. Here, we show unequivocally that the rolling motion derives from a persistent, nonplanar flagellar beat pattern. This is revealed by high-speed imaging and micromanipulation of live cells. We construct a fully 3D model to relate flagellar beating directly to the free-swimming trajectories. For realistic geometries, the model reproduces both the sense and magnitude of the axial rotation of live cells. We show that helical swimming requires further symmetry breaking between the two flagella. These functional differences underlie all tactic responses, particularly phototaxis. We propose a control strategy by which cells steer toward or away from light by modulating the sign of biflagellar dominance.",True,
267,10.1038/s41598-021-83961-z,https://www.semanticscholar.org/paper/5a6001a2671b4f479ef67ca7b5c5877eb4965de9,Sea stars generate downforce to stay attached to surfaces,"Intertidal sea stars often function in environments with extreme hydrodynamic loads that can compromise their ability to remain attached to surfaces. While behavioral responses such as burrowing into sand or sheltering in rock crevices can help minimize hydrodynamic loads, previous work shows that sea stars also alter body shape in response to flow conditions. This morphological plasticity suggests that sea star body shape may play an important hydrodynamic role. In this study, we measured the fluid forces acting on surface-mounted sea star and spherical dome models in water channel tests. All sea star models created downforce, i.e., the fluid pushed the body towards the surface. In contrast, the spherical dome generated lift. We also used Particle Image Velocimetry (PIV) to measure the midplane flow field around the models. Control volume analyses based on the PIV data show that downforce arises because the sea star bodies serve as ramps that divert fluid away from the surface. These observations are further rationalized using force predictions and flow visualizations from numerical simulations. The discovery of downforce generation could explain why sea stars are shaped as they are: the pentaradial geometry aids attachment to surfaces in the presence of high hydrodynamic loads.",True,
268,10.1016/j.aej.2020.10.027,https://www.semanticscholar.org/paper/1048b59800093869bacbeb5a46254488053ace7d,An improved artificial ecosystem optimization algorithm for optimal configuration of a hybrid PV/WT/FC energy system,"This paper mainly focuses on the optimal design of a grid-dependent and off-grid hybrid renewable energy system (RES). This system consists of Photovoltaic (PV), Wind Turbine (WT) as well as Fuel Cell (FC) with hydrogen gas tank for storing the energy in the chemical form. The optimal components sizes of the proposed hybrid generating system are achieved using a novel metaheuristic optimization technique. This optimization technique, called Improved Artificial Ecosystem Optimization (IAEO), is proposed for enhancing the performance of the conventional Artificial Ecosystem Optimization (AEO) algorithm. The IAEO improves the convergence trends of the original AEO, gives the best minimum objective function, reaches the optimal solution after a few iterations numbers as well as reduces the falling into the local optima. The proposed IAEO algorithm for solving the multiobjective optimization problem of minimizing the Cost of Energy (COE), the reliability index presented by the Loss of Power Supply Probability (LPSP), and excess energy under the constraints are considered. The hybrid system is suggested to be located in Ataka region, Suez Gulf (latitude 30.0, longitude 32.5), Egypt, and the whole lifetime of the suggested case study is 25 years. To ensure the accurateness, stability, and robustness of the proposed optimization algorithm, it is examined on six different configurations, representing on-grid and off-grid hybrid RES. For all the studied cases the proposed IAEO algorithm outperforms the original AEO and generates the minimum value of the fitness function in less execution time. Furthermore, comprehensive statistical measurements are demonstrated to prove the effectiveness of the proposed algorithm. Also, the results obtained by the conventional AEO and IAEO are compared with those obtained by several well-known optimization algorithms, Particle Swarm Optimization (PSO), Salp Swarm Algorithm (SSA), and Grey Wolf Optimizer (GWO). Based on the obtained simulation results, the proposed IAEO has the best performance among other algorithms and it has successfully positioned itself as a competitor to novel algorithms for tackling the most complicated engineering problems.",True,
269,10.1038/s41598-021-81421-2,https://www.semanticscholar.org/paper/d6e1c88c5994ca3ecc4534829ab9546e6df6fbc8,How neurons exploit fractal geometry to optimize their network connectivity,"We investigate the degree to which neurons are fractal, the origin of this fractality, and its impact on functionality. By analyzing three-dimensional images of rat neurons, we show the way their dendrites fork and weave through space is unexpectedly important for generating fractal-like behavior well-described by an ‘effective’ fractal dimension D. This discovery motivated us to create distorted neuron models by modifying the dendritic patterns, so generating neurons across wide ranges of D extending beyond their natural values. By charting the D-dependent variations in inter-neuron connectivity along with the associated costs, we propose that their D values reflect a network cooperation that optimizes these constraints. We discuss the implications for healthy and pathological neurons, and for connecting neurons to medical implants. Our automated approach also facilitates insights relating form and function, applicable to individual neurons and their networks, providing a crucial tool for addressing massive data collection projects (e.g. connectomes).",True,
270,10.1038/s41467-021-21179-3,https://www.semanticscholar.org/paper/72b74348680c1f41ffdd4f82d22e81612d7483b9,Meta-analysis of neural systems underlying placebo analgesia from individual participant fMRI data,"The brain systems underlying placebo analgesia are insufficiently understood. Here we performed a systematic, participant-level meta-analysis of experimental functional neuroimaging studies of evoked pain under stimulus-intensity-matched placebo and control conditions, encompassing 603 healthy participants from 20 (out of 28 eligible) studies. We find that placebo vs. control treatments induce small, widespread reductions in pain-related activity, particularly in regions belonging to ventral attention (including mid-insula) and somatomotor networks (including posterior insula). Behavioral placebo analgesia correlates with reduced pain-related activity in these networks and the thalamus, habenula, mid-cingulate, and supplementary motor area. Placebo-associated activity increases occur mainly in frontoparietal regions, with high between-study heterogeneity. We conclude that placebo treatments affect pain-related activity in multiple brain areas, which may reflect changes in nociception and/or other affective and decision-making processes surrounding pain. Between-study heterogeneity suggests that placebo analgesia is a multi-faceted phenomenon involving multiple cerebral mechanisms that differ across studies.",True,
271,10.1098/rspb.2020.3161,https://www.semanticscholar.org/paper/b5a62ac078b8a5f2f9efd10d66f3a46dbb06a1a8,Cuttlefish exert self-control in a delay of gratification task,"The ability to exert self-control varies within and across taxa. Some species can exert self-control for several seconds whereas others, such as large-brained vertebrates, can tolerate delays of up to several minutes. Advanced self-control has been linked to better performance in cognitive tasks and has been hypothesized to evolve in response to specific socio-ecological pressures. These pressures are difficult to uncouple because previously studied species face similar socio-ecological challenges. Here, we investigate self-control and learning performance in cuttlefish, an invertebrate that is thought to have evolved under partially different pressures to previously studied vertebrates. To test self-control, cuttlefish were presented with a delay maintenance task, which measures an individual's ability to forgo immediate gratification and sustain a delay for a better but delayed reward. Cuttlefish maintained delay durations for up to 50–130 s. To test learning performance, we used a reversal-learning task, whereby cuttlefish were required to learn to associate the reward with one of two stimuli and then subsequently learn to associate the reward with the alternative stimulus. Cuttlefish that delayed gratification for longer had better learning performance. Our results demonstrate that cuttlefish can tolerate delays to obtain food of higher quality comparable to that of some large-brained vertebrates.",True,
272,10.1098/rsbl.2020.0892,https://www.semanticscholar.org/paper/e2e0e75043881c3ee0e208602e8c9937e9739964,Hide-and-seek strategies and post-contact immobility,"To understand why an animal might gain by playing dead, or more precisely, exhibit post-contact immobility (PCI), we consider the context in which this behaviour occurs. Is it, for example, a method by which a potential victim encourages a predator to direct its attention elsewhere? We investigate this possibility by using the marginal value theorem to analyse predator behaviour in the context of this defence strategy by potential prey. We consider two models. In the first, (random revisiting) the predator may return to sites it has already depleted within the patch. In the second, (systematic search) the predator goes only to new sites within the patch. The results of the two models are qualitatively extremely similar. We show that when prey occur in patches, PCI favours prey survival. Indeed, certain antlion larvae have PCI durations characterized by very long half-lives. These appear to be of such long durations that further increases would convey no substantial benefits in redirecting potential predators to other antlions within the patch and subsequently to other patches.",True,
273,10.1016/j.cub.2021.01.048,https://www.semanticscholar.org/paper/0abba4bd78f6f838b68b916b8a715900cfc30f56,Lung mediated auditory contrast enhancement improves the Signal-to-noise ratio for communication in frogs,"Environmental noise is a major source of selection on animal sensory and communication systems. The acoustic signals of other animals represent particularly potent sources of noise for chorusing insects, frogs, and birds, which contend with a multi-species analog of the human ""cocktail party problem"" (i.e., our difficulty following speech in crowds). However, current knowledge of the diverse adaptations that function to solve noise problems in nonhuman animals remains limited. Here, we show that a lung-to-ear sound transmission pathway in frogs serves a heretofore unknown noise-control function in vertebrate hearing and sound communication. Inflated lungs improve the signal-to-noise ratio for communication by enhancing the spectral contrast in received vocalizations in ways analogous to signal processing algorithms used in hearing aids and cochlear implants. Laser vibrometry revealed that the resonance of inflated lungs selectively reduces the tympanum's sensitivity to frequencies between the two spectral peaks present in conspecific mating calls. Social network analysis of continent-scale citizen science data on frog calling behavior revealed that the calls of other frog species in multi-species choruses can be a prominent source of environmental noise attenuated by the lungs. Physiological modeling of peripheral frequency tuning indicated that inflated lungs could reduce both auditory masking and suppression of neural responses to mating calls by environmental noise. Together, these data suggest an ancient adaptation for detecting sound via the lungs has been evolutionarily co-opted to create auditory contrast enhancement that contributes to solving a multi-species cocktail party problem.",True,
274,10.1016/j.cub.2021.01.048,https://www.semanticscholar.org/paper/0abba4bd78f6f838b68b916b8a715900cfc30f56,Lung mediated auditory contrast enhancement improves the Signal-to-noise ratio for communication in frogs,"Environmental noise is a major source of selection on animal sensory and communication systems. The acoustic signals of other animals represent particularly potent sources of noise for chorusing insects, frogs, and birds, which contend with a multi-species analog of the human ""cocktail party problem"" (i.e., our difficulty following speech in crowds). However, current knowledge of the diverse adaptations that function to solve noise problems in nonhuman animals remains limited. Here, we show that a lung-to-ear sound transmission pathway in frogs serves a heretofore unknown noise-control function in vertebrate hearing and sound communication. Inflated lungs improve the signal-to-noise ratio for communication by enhancing the spectral contrast in received vocalizations in ways analogous to signal processing algorithms used in hearing aids and cochlear implants. Laser vibrometry revealed that the resonance of inflated lungs selectively reduces the tympanum's sensitivity to frequencies between the two spectral peaks present in conspecific mating calls. Social network analysis of continent-scale citizen science data on frog calling behavior revealed that the calls of other frog species in multi-species choruses can be a prominent source of environmental noise attenuated by the lungs. Physiological modeling of peripheral frequency tuning indicated that inflated lungs could reduce both auditory masking and suppression of neural responses to mating calls by environmental noise. Together, these data suggest an ancient adaptation for detecting sound via the lungs has been evolutionarily co-opted to create auditory contrast enhancement that contributes to solving a multi-species cocktail party problem.",True,
275,10.1016/j.anbehav.2020.04.005,https://www.semanticscholar.org/paper/1c1de56ac37946a3aea90066f77518605f578475,Protective coloration of European vipers throughout the predation sequence,"Antipredator adaptations in the form of animal coloration are common and often multifunctional. European vipers (genus Vipera) have a characteristic dorsal zigzag pattern, which has been shown to serve as a warning signal to potential predators. At the same time, it has been suggested to decrease detection risk, and to cause a motion dazzle or flicker–fusion effect during movement. We tested these hypotheses by asking whether (1) the zigzag pattern decreases detection risk and (2) the detection is dependent on the base coloration (grey or brown) or the snake's posture (coiled, basking form or S-shaped, active form). Additionally, (3) we measured the fleeing speed of adders, Vipera berus, and calculated the flicker rate of the zigzag pattern, to see whether it is fast enough to cause a flicker–fusion effect against predators. Our results show that the zigzag pattern reduced detectability regardless of base coloration or posture of the snake. The brown zigzag morph was detected less often than the grey zigzag morph. The fleeing speed of adders appeared to be fast enough to induce a flicker–fusion effect for mammalian predators. However, it is unlikely to be fast enough to induce the flicker–fusion effect for raptors. Our findings highlight that the colour pattern of animals can be multifunctional. The same colour pattern that can decrease detection by predators can also serve as a warning function once detected, and potentially hinder capture during an attack.",True,
276,10.1016/j.cub.2021.01.014,https://www.semanticscholar.org/paper/d26a3ba8abb79efa29bc86d9be838c4a37257c6d,Extreme autotomy and whole-body regeneration in photosynthetic sea slugs,"Autotomy, the voluntary shedding of a body part, is common to distantly-related animals such as arthropods, gastropods, asteroids, amphibians, and lizards1,2. Autotomy is generally followed by regeneration of shed terminal body parts, such as appendages or tails. Here, we identify a new type of extreme autotomy in two species of sacoglossan sea slug (Mollusca: Gastropoda). Surprisingly, they shed the main body, including the whole heart, and regenerated a new body. In contrast, the shed body did not regenerate the head. These sacoglossans can incorporate chloroplasts from algal food into their cells to utilise for photosynthesis (kleptoplasty3), and we propose that this unique characteristic may facilitate survival after autotomy and subsequent regeneration.",True,
