,doi,url,title,abstract,is_open_access,journal_name,is_biomimicry
377,10.1007/s00360-010-0457-y,https://www.semanticscholar.org/paper/c93c4d31251bc4b1d0871809958b59cbf2834af8,Thermoregulatory variation among populations of bats along a latitudinal gradient,"Most studies of hibernation physiology sample individuals from populations within a single geographic area, yet some species have large ranges meaning populations likely experience area-specific levels of energetic challenges. As well, few studies have assessed within-season variation. Since physiological adjustments often are influenced by environmental factors, and the types of environments vary with geography, we expected variance in hibernation patterns among geographically separated populations. Our specific goal was to measure intraspecific variation in torpid metabolic rate (TMR) and body temperature (Tb) as a function of ambient temperature (Ta) for a non-migratory and migratory species to determine whether there is a continuum in physiological responses based on latitude. We chose big brown (Eptesicus fuscus) and eastern red bats (Lasiurus borealis) as model species and sampled individuals from populations throughout each species’ winter range. In both species, individuals from southern populations maintained higher TMR at cooler Tas and lower TMR at warmer Tas than those from northern populations. Big brown bats from southern populations regulated Tb during torpor at higher levels and there was no significant difference in Tb between populations of eastern red bats. Although metabolic responses were similar across the gradient between species, the effect was more dramatic in big brown bats. Our data demonstrate a continuum in thermoregulatory response, ranging from classic hibernation in northern populations to a pattern more akin to daily torpor in southern populations. Our research highlights the potential usefulness of bats as model organisms to address questions about within-species physiological variation in wild populations.",False,Journal of Comparative Physiology B,False
378,10.1007/s00359-010-0512-x,https://www.semanticscholar.org/paper/e62711b7f18dd9c0a4c9562344de399fae5c1cb4,"Spinal reflexes in the long-tailed stingray, Himantura fai","We have exploited the segregation of motor and sensory axons into peripheral nerve sub-compartments to examine spinal reflex interactions in anaesthetized stingrays. Single, supra-maximal electrical stimuli delivered to segmental sensory nerves elicited compound action potentials in the motor nerves of the stimulated segment and in rostral and caudal segmental motor nerves. Compound action potentials elicited in segmental motor nerves by single stimuli delivered to sensory nerves were increased severalfold by prior stimulation of adjacent sensory nerves. This facilitation of the segmental reflex produced by intense conditioning stimuli decreased as it was applied to more remote segments, to approximately the same degree in up to seven segments in the rostral and caudal direction. In contrast, an asymmetric response was revealed when test and conditioning stimuli were delivered to different nerves, neither of which was of the same segment as the recorded motor nerve: in this configuration, conditioning volleys generally inhibited the responses of motoneurons to stimuli delivered to more caudally located sensory nerves. This suggests that circuitry subserving trans-segmental interactions between spinal afferents is present in stingrays and that interneuronal connections attenuate the influence that subsequent activity in caudal primary afferents can have on the motor elements.",False,Journal of Comparative Physiology A,False
379,10.1007/s00359-010-0513-9,https://www.semanticscholar.org/paper/4ab91e2f47251e5696a59cc31d72f6d1382e8d8c,"Age-dependent cyclic locomotor activity in the cricket, Gryllus bimaculatus, and the effect of adipokinetic hormone on locomotion and excitability","Excitability and locomotor activity of male and female last instar larvae and adults of the two-spotted cricket are measured under crowded conditions, allowing the animals to interact with conspecifics during observations. Male and female last instar larvae display age-dependent cyclic patterns of activity with maxima during early to mid scotophase and minima during early photophase. A period of low locomotor activity without time of day-dependent cyclic changes starts 1 day before the final moult and lasts until 1 day after the moult. Then, both excitability and locomotor activity increase and become cyclic again within 2 or 3 days. The cyclic changes gradually dampen in adult females older than 6 days and finally cease. When injected into photophase larvae and adults, adipokinetic hormone (AKH) increases excitability and locomotor activity in a dose-dependent manner, whereas it has no such effect when injected into scotophase animals. Other behaviours (jumping, hind wing trembling) that mostly occur in scotophase crickets are also increased by injecting AKH into photophase crickets. We argue that AKH could be responsible for linking the endogenous clock output with the cyclic changes in locomotor activity. Furthermore, AKH may serve to synchronise metabolism and behaviour to optimise larval development and reproduction.",False,Journal of Comparative Physiology A,False
380,10.1007/s00359-010-0514-8,https://www.semanticscholar.org/paper/1db76418d51ef60e309e55c10567462cef9fa138,The structure and size of sensory bursts encode stimulus information but only size affects behavior,"Cricket ultrasound avoidance is a classic model system for neuroethology. Avoidance steering is triggered by high-firing-rate bursts of spikes in the auditory command neuron AN2. Although bursting is common among sensory neurons, and although the detailed structure of bursts may encode information about the stimulus, it is as yet unclear whether this information is decoded. We address this question in two ways: from an information coding point of view, by showing the relationship between stimulus and burst structure; and also from a functional point of view by showing the relationship between burst structure and behavior. We conclude that the burst structure carries detailed temporal information about the stimulus but that this has little impact on the behavioral response, which is affected mainly by burst size.",False,Journal of Comparative Physiology A,False
381,10.1007/s00359-010-0515-7,https://www.semanticscholar.org/paper/420737b9b968152eb1885ef0f907820a3942b6af,Intensity invariance properties of auditory neurons compared to the statistics of relevant natural signals in grasshoppers,"The temporal pattern of amplitude modulations (AM) is often used to recognize acoustic objects. To identify objects reliably, intensity invariant representations have to be formed. We approached this problem within the auditory pathway of grasshoppers. We presented AM patterns modulated at different time scales and intensities. Metric space analysis of neuronal responses allowed us to determine how well, how invariantly, and at which time scales AM frequency is encoded. We find that in some neurons spike-count cues contribute substantially (20–60%) to the decoding of AM frequency at a single intensity. However, such cues are not robust when intensity varies. The general intensity invariance of the system is poor. However, there exists a range of AM frequencies around 83 Hz where intensity invariance of local interneurons is relatively high. In this range, natural communication signals exhibit much variation between species, suggesting an important behavioral role for this frequency band. We hypothesize, just as has been proposed for human speech, that the communication signals might have evolved to match the processing properties of the receivers. This contrasts with optimal coding theory, which postulates that neuronal systems are adapted to the statistics of the relevant signals.",False,Journal of Comparative Physiology A,False
382,10.1007/s00360-010-0454-1,https://www.semanticscholar.org/paper/a43d6db0df5d717701465012d39115ee5fe19688,Bioelectrical activity in the heart of the lugworm Arenicola marina,"Standard microelectrode technique was used to study electrical activity of the isolated heart of the polychaete annelid, Arenicola marina. Typical pacemaker activity with slow diastolic depolarization was observed in all recordings. The average maximum diastolic potential (−58.4 ± 3.2 mV), the average amplitude of the action potential (28.7 ± 4.7 mV) and the average total duration of the action potential (2,434 ± 430 ms) were determined. There has been no gradient of automaticity observed in our studies, which suggests that all regions of the Arenicola heart could possess pacemaker functions. Acetylcholine (ACh) produced a concentration dependent (5 × 10−8–5 × 10−5 M) increase of the beating rate via increase in the rate of the diastolic depolarization. ACh (5 × 10−5 M) increased beating rate by 2.5-fold compared to the control rate. A stronger action of ACh resulted in depolarization, block of action potential generation and contracture of the heart. The non-hydrolysable ACh analog carbacholine (10−8–10−6 M) produced similar effects. All effects of ACh and carbacholine were abolished by 5 × 10−6 M atropine. d-Tubocurarine (5 × 10−5 M) did not significantly alter effects of ACh or carbacholine. Epinephrine (10−8–10−6 M) caused the slowing of pacemaker activity and marked decrease of action potential duration. 10−6 M epinephrine produced complete cardiac arrest. The effects of epinephrine were not significantly altered by the β-blocker propranolol (5 × 10−6 M). The β-agonist isoproterenol (10−7–10−5 M) and the α-agonist xylometazoline (10−6–10−5 M) did not produce significant effects. Thus, cholinergic effects in the Arenicola heart are likely to be mediated via muscarinic receptors, while the nature of adrenergic effects needs further investigation.",False,Journal of Comparative Physiology B,False
383,10.1007/s00360-010-0455-0,https://www.semanticscholar.org/paper/b144330c8ead1baecbcf49de0dc6f94e960060ad,Oxygen-dependence of metabolic rate in the muscles of craniates,"We present evidence that oxygen consumption $$ (V_{{{\text{O}}_{2} }} ) $$ is oxygen partial pressure $$ (P_{{{\text{O}}_{2} }} ) $$ dependent in striated muscles and $$ P_{{{\text{O}}_{2} }} $$-independent in the vasculature in representatives of three craniate taxa: two teleost fish, a hagfish and a rat. Blood vessel $$ V_{{{\text{O}}_{2} }} $$ displayed varying degrees of independence in a $$ P_{{{\text{O}}_{2} }} $$ range of 15–95 mmHg, while $$ V_{{{\text{O}}_{2} }} $$ by striated muscle tissue slices from all species related linearly to $$ P_{{{\text{O}}_{2} }} $$ between 0 and 125 mmHg, despite $$ V_{{{\text{O}}_{2} }} $$ rates varying greatly between species and muscle type. In salmon red muscle, lactate concentrations fell in slices incubated at a $$ P_{{{\text{O}}_{2} }} $$ of either 30 or 100 mmHg, suggesting aerobic rather than anaerobic metabolism. Consistent with this finding, potential energy, a proxy of ATP turnover, was $$ P_{{{\text{O}}_{2} }} $$-dependent. Our data suggest that the reduction in $$ V_{{{\text{O}}_{2} }} $$ with falling $$ P_{{{\text{O}}_{2} }} $$ results in a decrease in ATP demand, suggesting that the hypoxic signal is sensed and cellular changes effected. Viability and diffusion limitation of the preparations were investigated using salmon cardiac and skeletal muscles. Following the initial $$ P_{{{\text{O}}_{2} }} $$ depletion, reoxygenation of the Ringer bathing salmon cardiac muscle resulted in $$ V_{{{\text{O}}_{2} }} {\text{s}} $$ that was unchanged from the first run. $$ V_{{{\text{O}}_{2} }} $$ increased in all muscles uncoupled with p-trifluoromethoxylphenyl-hydrazone (FCCP) and 2,4-dinitrophenol (DNP). Mitochondrial succinate dehydrogenase activity, quantified by reduction of 3-(4,5-dimethylthiazol)-2,5-diphenyl-2H-tetrazolium bromide (MTT) to formazan, was constant over the course of the experiment. These three findings indicate that the tissues remained viable over time and ruled out diffusion-limitation as a constraint on $$ V_{{{\text{O}}_{2} }} $$.",False,Journal of Comparative Physiology B,False
384,10.1007/s00359-010-0511-y,https://www.semanticscholar.org/paper/5884c0d51a03122b815b484ec681d8bbec1500a7,Electrophysiological properties of isthmic neurons in frogs revealed by in vitro and in vivo studies,"The frog nucleus isthmi (parabigeminal nucleus in mammals) is a visually responsive, cholinergic and anatomically well-defined group of neurons in the midbrain. It shares reciprocal topographic projections with the ipsilateral optic tectum (superior colliculus in mammals) and strongly influences visual processing. Anatomical and biochemical information indicates the existence of distinct neural populations within the frog nucleus isthmi, which raises the question: are there electrophysiological distinctions between neurons that are putatively classified by their anatomical and biochemical properties? To address this question, we measured frog nucleus isthmi neuron cellular properties in vitro and visual response properties in vivo. No evidence for distinct electrophysiological classes of neurons was found. We thus conclude that, despite the anatomical and biochemical differences, the cells of the frog nucleus isthmi respond homogeneously to both current injections and simple visual stimuli.",True,Journal of Comparative Physiology A,False
385,10.1007/s00360-010-0451-4,https://www.semanticscholar.org/paper/6c3a927125da7ef9ebd47c74c60619f8b9208196,"Interactions between light, mealtime and calorie restriction to control daily timing in mammals","Daily variations in behaviour and physiology are controlled by a circadian timing system consisting of a network of oscillatory structures. In mammals, a master clock, located in the suprachiasmatic nuclei (SCN) of the hypothalamus, adjusts timing of other self-sustained oscillators in the brain and peripheral organs. Synchronisation to external cues is mainly achieved by ambient light, which resets the SCN clock. Other environmental factors, in particular food availability and time of feeding, also influence internal timing. Timed feeding can reset the phase of the peripheral oscillators whilst having almost no effect in shifting the phase of the SCN clockwork when animals are exposed (synchronised) to a light–dark cycle. Food deprivation and calorie restriction lead not only to loss of body mass (>15%) and increased motor activity, but also affect the timing of daily activity, nocturnal animals becoming partially diurnal (i.e. they are active during their usual sleep period). This change in behavioural timing is due in part to the fact that metabolic cues associated with calorie restriction affect the SCN clock and its synchronisation to light.",False,Journal of Comparative Physiology B,False
386,10.1007/s00360-010-0449-y,https://www.semanticscholar.org/paper/78a6bb17972983ef2e2359816a6bc2182c7afcf3,"Bioenergetics of torpor in the Microbiotherid marsupial, Monito del Monte (Dromiciops gliroides): the role of temperature and food availability","Torpor is the physiologically controlled reduction of metabolic rate and body temperature experienced by small birds and mammals when facing periods of low temperature and/or food shortage. In this study, we provide a first quantitative description of torpor in the relict marsupial Dromiciops gliroides by: (1) characterizing body temperature (TB) and torpor patterns, (2) evaluating the combined effects of ambient temperature and different levels of food restriction on torpor incidence and (3) exploring the metabolic depression during torpor. D. gliroides exhibited short bouts of torpor on a daily basis, during which TB decreased close to ambient temperature. During the active phase, TB also exhibited pronounced variation (range 34–38°C). In order to evaluate the consistency of torpor, we computed the repeatability of TB. Using the whole dataset, repeatability was significant (τ = 0.28). However, when torpid individuals were excluded from the analysis, repeatability was non-significant: some individuals were more prone to experience torpor than others. Our results indicate that this species also exhibits short bouts of daily torpor, whose depth and duration depends on the joint effects of TA and food availability. At TA = 20°C, the maximum torpor incidence was found at 70–80% food reduction, while at both extremes of the food continuum (100 and 0–10% food reduction) individuals were completely active, although considerable variation in TB was recorded. At TA = 10°C, individuals developed a deep form of torpor that was independent of the amount of food provided. On average, torpid D. gliroides reduced their metabolic rate up to 92% of their active values. In general, our results suggest that TA was the most immediate determinant of torpor, followed by energy availability.",True,Journal of Comparative Physiology B,False
387,10.1007/s00359-010-0509-5,https://www.semanticscholar.org/paper/fd8be91b2e06dcc88eb0cc32ebd2b9159054541e,Muscular waves contribute to gliding rate in the freshwater gastropod Lymnaea stagnalis,"This study revises the mechanisms of ciliary locomotion and demonstrates muscular contribution to locomotion rate in Lymnaea stagnalis. L. stagnalis sticks to the substratum by the foot sole and moves smoothly with no visible contractions of the foot. A ciliated epithelium covering the sole is underlain by smooth muscle cells containing giant mitochondria. It is shown here that slow (basal) locomotor activity (measured as the flow rate of physiological saline over isolated sole) appears spontaneously or is induced by 10−8–10−7 M 5-HT. 5-HT (10−7–10−4 M) facilitates locomotor activity dose-dependently, and KCN (an inhibitor of mitochondrial respiration) decreases these effects to the basal level. 5-HT and KCN have no effect on the frequency of ciliary beat (stroboscopic measurements), and blockers of anaerobic glycolysis inhibit ciliary motility. Under anaerobic conditions locomotion of a snail is slow and insensitive to 5-HT in contrast to that in aerobic environments. It is concluded that glycolysis supplies energy to ciliated cells and respiration to sole muscle cells; 5-HT stimulates ciliary beating in an all-or-none fashion and muscular waves in a dose-dependent manner; cilia provide slow (basal) gliding, and locomotory rate up to 80% above the basal level is determined by muscular waves.",False,Journal of Comparative Physiology A,False
388,10.1007/s00360-010-0447-0,https://www.semanticscholar.org/paper/6667b541382007d86d5a6ecc02affe53edbc7a1f,Freshwater elasmobranchs: a review of their physiology and biochemistry,"Only 5% of elasmobranch species live in freshwater (FW) compared to more than 40% of known teleost species. The factors affecting the poor penetration of elasmobranchs into FW environments are currently unknown, however, an important consideration may be the high urea requirement of many proteins in marine elasmobranchs. Urea is an important osmolyte in marine elasmobranchs and must be reduced in dilute environments. There are three identifiable stages in the successful colonization of FW. The euryhaline marine species freely entering and leaving FW represent the initial stage of FW colonization. In this group, there is an apparent inability to eliminate all urea due to protein integrity issues and this results in energy and nitrogen losses that may constrain growth and reproduction. The second stage is represented by those species that live entirely in FW but must also retain some urea. This group also suffers from the same constraints as the first group. These two groups have kidneys and sensory organs that more closely resemble strictly marine forms. The third and final stage is represented by the Potamotrygonid stingrays where the need for urea in FW has been eliminated. Consequently nitrogen and energy losses are reduced and those sections of the kidney needed for urea conservation have been eliminated. The driving force for such modifications is a reduction in urea levels and the concomitant saving of energy needed for urea synthesis. Other physiological adaptations associated with survival in FW include giving birth to live young, the capacity of sperm to be activated in freshwater and modifications of the electrosensory system to function in a low conductivity environment. The need for many anatomical, metabolic and physiological modifications for FW existence may constrain the rapidity and hence the frequency of FW colonization, compared to the situation in the more advanced osmoregulating teleosts. Once optimally adapted to FW, recolonization of sea water by elasmobranchs is problematic due to the loss of urea synthetic capacity and renal structures for urea retention.",False,Journal of Comparative Physiology B,False
389,10.1007/s00360-010-0448-z,https://www.semanticscholar.org/paper/3669cae562bdbc0803e1bad9f5f5d1f592044b69,Postnatal development of muscle biochemistry in nursing harbor seal (Phoca vitulina) pups: limitations to diving behavior?,"Adult marine mammal muscles rely upon a suite of adaptations for sustained aerobic metabolism in the absence of freely available oxygen (O2). Although the importance of these adaptations for supporting aerobic diving patterns of adults is well understood, little is known about postnatal muscle development in young marine mammals. However, the typical pattern of vertebrate muscle development, and reduced tissue O2 stores and diving ability of young marine mammals suggest that the physiological properties of harbor seal (Phoca vitulina) pup muscle will differ from those of adults. We examined myoglobin (Mb) concentration, and the activities of citrate synthase (CS), β-hydroxyacyl coA dehydrogenase (HOAD), and lactate dehydrogenase (LDH) in muscle biopsies from harbor seal pups throughout the nursing period, and compared these biochemical parameters to those of adults. Pups had reduced O2 carrying capacity ([Mb] 28–41% lower than adults) and reduced metabolically scaled catabolic enzyme activities (LDH/RMR 20–58% and CS/RMR 29–89% lower than adults), indicating that harbor seal pup muscles are biochemically immature at birth and weaning. This suggests that pup muscles do not have the ability to support either the aerobic or anaerobic performance of adult seals. This immaturity may contribute to the lower diving capacity and behavior in younger pups. In addition, the trends in myoglobin concentration and enzyme activity seen in this study appear to be developmental and/or exercise-driven responses that together work to produce the hypoxic endurance phenotype seen in adults, rather than allometric effects due to body size.",False,Journal of Comparative Physiology B,False
390,10.1007/s00359-010-0507-7,https://www.semanticscholar.org/paper/4c1357c5605f7217bf7af27ec486949064579a17,Intralateral hypothalamic area injection of isoproterenol and propranolol affects food and water intake in broilers,"The role played by adrenergic system in water intake, especially food intake, has long been known in mammals. In avian species, there have been many experiments exploring the effects of the adrenergic system in different sites in the central nervous system in meat- and egg-type poultry. This study was designed to examine the possible effects of intralateral hypothalamic area (ILHy) microinjections of a beta-adrenergic agonist, isoproterenol, and a beta-adrenoceptor blocker, propranolol, on food and water intake in 3-h food-deprived and 3-h water-deprived broiler cockerels. Our findings suggest that the β-adrenergic system directly affects food especially water intake in broilers. Although isoproterenol significantly (P ≤ 0.05) decreased food intake for the first 15 min, it reduced food intake during the experiment. Isoproterenol reduced water intake significantly (P ≤ 0.05), which was abolished by pretreatment with propranolol. It is proposed that β-adrenoceptors in LHy play a direct and indirect role in the regulation of food especially water intake in broiler cockerels.",False,Journal of Comparative Physiology A,False
391,10.1007/s00359-010-0508-6,https://www.semanticscholar.org/paper/3894aae9ff0f8c4d5d2d0032d6454afa28885479,Target-approaching behavior of barn owls (Tyto alba): influence of sound frequency,"We studied the influence of frequency on sound localization in free-flying barn owls by quantifying aspects of their target-approaching behavior to a distant sound source during ongoing auditory stimulation. In the baseline condition with a stimulus covering most of the owls hearing range (1–10 kHz), all owls landed within a radius of 20 cm from the loudspeaker in more than 80% of the cases and localization along the azimuth was more accurate than localization in elevation. When the stimulus contained only high frequencies (>5 kHz) no changes in striking behavior were observed. But when only frequencies from 1 to 5 kHz were presented, localization accuracy and precision decreased. In a second step we tested whether a further border exists at 2.5 kHz as suggested by optimality models. When we compared striking behavior for a stimulus having energy from 2.5 to 5 kHz with a stimulus having energy between 1 and 2.5 kHz, no consistent differences in striking behavior were observed. It was further found that pre-takeoff latency was longer for the latter stimulus than for baseline and that center frequency was a better predictor for landing precision than stimulus bandwidth. These data fit well with what is known from head-turning studies and from neurophysiology.",False,Journal of Comparative Physiology A,False
