,doi,url,title,abstract,is_open_access,journal_name,is_biomimicry
115,10.1007/s00359-011-0649-2,https://www.semanticscholar.org/paper/704311f2911b1f82d802c958f26618af9e60f801,Visual stimuli that elicit appetitive behaviors in three morphologically distinct species of praying mantis,"We assessed the differences in appetitive responses to visual stimuli by three species of praying mantis (Insecta: Mantodea), Tenodera aridifolia sinensis, Mantis religiosa, and Cilnia humeralis. Tethered, adult females watched computer generated stimuli (erratically moving disks or linearly moving rectangles) that varied along predetermined parameters. Three responses were scored: tracking, approaching, and striking. Threshold stimulus size (diameter) for tracking and striking at disks ranged from 3.5 deg (C. humeralis) to 7.8 deg (M. religiosa), and from 3.3 deg (C. humeralis) to 11.7 deg (M. religiosa), respectively. Unlike the other species which struck at disks as large as 44 deg, T. a. sinensis displayed a preference for 14 deg disks. Disks moving at 143 deg/s were preferred by all species. M. religiosa exhibited the most approaching behavior, and with T. a. sinensis distinguished between rectangular stimuli moving parallel versus perpendicular to their long axes. C. humeralis did not make this distinction. Stimulus sizes that elicited the target behaviors were not related to mantis size. However, differences in compound eye morphology may be related to species differences: C. humeralis’ eyes are farthest apart, and it has an apparently narrower binocular visual field which may affect retinal inputs to movement-sensitive visual interneurons.",False,Journal of Comparative Physiology A,False
116,10.1007/s00359-011-0648-3,https://www.semanticscholar.org/paper/03da3bf8a0f9390a4bad966bd7b732aaaa1d7242,Thermal dependence of locomotor performance in two cool-temperate lizards,"Temperate-zone ectotherms experience varying or very low ambient temperatures and may have difficulty in attaining preferred body temperatures. Thus, adaptations to reduce the thermal dependence of physiological processes may be present. We measured the optimal temperature range for sprint speed and compared it with the selected body temperatures (Tsel) of two sympatric, cool-temperate lizards: the diurnal skink Oligosoma maccanni and the primarily nocturnal gecko Woodworthia (previously Hoplodactylus) “Otago/Southland”. We also investigated whether time-of-day influenced sprint speed. Contrary to results for other reptiles, we found that time-of-day did not influence speed in either species. For each species, the optimal temperature range for sprinting and Tsel overlapped, supporting the ‘thermal coadaptation’ hypothesis. However, the optimal range of temperatures for speed is not always attainable during activity by either species, which have limited opportunities to attain Tsel in the field. The thermal sensitivity of sprint speed in these two species does not appear to have evolved to fully match their current thermal environment. More data on cold-adapted species are needed to fully understand physiological adaptation in ectotherms.",False,Journal of Comparative Physiology A,False
117,10.1007/s00359-011-0646-5,https://www.semanticscholar.org/paper/10be62c1982e32ddd7cf6c973e9b97f651a2ac13,Olfactory sensitivity to amino acids in the blackspot sea bream (Pagellus bogaraveo): a comparison between olfactory receptor recording techniques in seawater,"The current study investigated the olfactory sensitivity of the blackspot sea bream to amino acids, odorants associated with food detection in fish, and compared the efficacy of two different experimental methods: multi-unit recording from the olfactory nerve and the electro-olfactogram (EOG). Twenty essential amino acids plus l-DOPA evoked clear, concentration-dependent olfactory responses using both methods, with estimated thresholds of 10−8.5–10−6.2 M (nerve recording) and 10−7.5–10−4.8 M (EOG). The most potent amino acids were l-cysteine, l-methionine (both sulphur-containing), l-alanine, l-leucine (both neutral), l-glutamine (amide-containing) and l-serine (hydroxyl-containing). The least potent were l-proline (secondary α-amino group), the aromatic amino acids and glycine (simplest). Although the rank order of olfactory potency was similar for the two methods used, and the calculated thresholds given by the two methods were positively correlated, the sensitivity of the EOG was consistently lower than multi-unit recording by approximately one order of magnitude, presumably due to the electrical shunting effect of seawater. As in freshwater, the EOG could be a valid method for comparing olfactory potency of different odorants in stenohaline marine fish; however, for absolute ‘biological’ thresholds, a more invasive recording technique, such as multi-unit recording from the olfactory nerve, should be used.",False,Journal of Comparative Physiology A,False
118,10.1007/s00359-011-0647-4,https://www.semanticscholar.org/paper/b6e89ce1e71d40213fc6100b11a02edac477734d,"Encoding of force increases and decreases by tibial campaniform sensilla in the stick insect, Carausius morosus","Detection of force increases and decreases is important in motor control. Experiments were performed to characterize the structure and responses of tibial campaniform sensilla, receptors that encode forces through cuticular strains, in the middle leg of the stick insect (Carausius morosus). The sensilla consist of distinct subgroups. Group 6A sensilla are located 0.3 mm distal to the femoro-tibial joint and have oval shaped cuticular caps. Group 6B receptors are 1 mm distal to the joint and have round caps. All sensilla show directional, phasico-tonic responses to forces applied to the tibia in the plane of joint movement. Group 6B sensilla respond to force increases in the direction of joint extension while Group 6A receptors discharge when those forces decrease. Forces applied in the direction of joint flexion produce the reverse pattern of sensory discharge. All receptors accurately encode the rate of change of force increments and decrements. Contractions of tibial muscles also produce selective, directional sensory discharges. The subgroups differ in their reflex effects: Group 6B receptors excite and Group 6A sensilla inhibit tibial extensor and trochanteral depressor motoneurons. The tibial campaniform sensilla can, therefore, encode force increases or decreases and aid in adapting motor outputs to changes in load.",False,Journal of Comparative Physiology A,False
119,10.1007/s00360-011-0581-3,https://www.semanticscholar.org/paper/1f2815e73255d118e184d783393c35f5224bbf40,Does simultaneous UV-B exposure enhance the lethal and sub-lethal effects of aquatic hypoxia on developing anuran embryos and larvae?,"Recent catastrophic global amphibian declines have been partially linked to increases in UV-B radiation as a consequence of stratospheric ozone depletion. Previous studies have shown that in the presence of other environmental stressors including aquatic pH and temperature and the presence of contaminants or pathogens, the lethal effects of UV-B on amphibian larvae are enhanced due to interactions between the stressors. Little is known about the interactions between UV-B and aquatic hypoxia, a common and significant natural stressor of amphibian larvae. We examined the potential effects of UV-B and aquatic hypoxia in combination on embryonic survival, developmental rate, body mass and locomotor performance of embryos and larvae of the striped marsh frog, Limnodynastes peronii. We found that while both UV-B and hypoxia independently had substantial negative effects on the developing embryos of L. peronii, they did not interact in a multiplicative or antagonistic manner. The effects of the stressors in combination were as might be predicted based on the knowledge of their independent actions alone (i.e. an additive effect). In all cases developing embryos exposed to both UV-B and hypoxia were more severely affected than those exposed to either UV-B or hypoxia alone. The results of this study show the importance of examining both the direct actions of individual stressors and how these may be influenced by the presence of other environmental factors.",False,Journal of Comparative Physiology B,False
120,10.1007/s00360-011-0583-1,https://www.semanticscholar.org/paper/36f479cc7cfd61f1a764e92f4ecca6453a20ae0e,"Effect of hypercapnia on intracellular pH regulation in a rainbow trout hepatoma cell line, RTH 149","Fish exposed to elevated water CO2 experience a rapid increase in blood CO2 levels (hypercapnia), resulting in acidification of both intra- and extra-cellular compartments. While the mechanisms associated with extracellular pH regulation have been well explored, much less is known about intracellular pH (pHi) regulation. There is great interest in developing non-animal models for research. One such model is the rainbow trout hepatoma cell line (RTH 149), which has been used to study a wide range of topics; however, no studies have investigated its potential use in pHi regulation. Employing the pH-sensitive fluoroprobe BCECF, the present study examined pHi regulation in RTH 149 under normocapnia and during extracellular acidification induced by either elevated CO2 or 1 M HCl. During exposure to hypercapnia, RTH 149 cells were acidified without recovery as long as the elevated CO2 was maintained. In addition, rates of pHi recovery from NH4Cl-induced acidosis were significantly lower in cells exposed to hypercapnia or HCl compared to that in normocapnic cells, indicating that elevated CO2 indirectly impeded pHi recovery through a reduction in pHe and/or pHi. Moreover, pHi regulation in RTH 149 was EIPA-sensitive, suggesting that an NHE may be involved. Overall, RTH 149 may have the potential for identifying transporters likely to play a role in pHi regulation in fish. However, it should not be used as a complete replacement for in vivo studies, especially to quantify acid–base regulatory ability at whole animal level, since RTH 149 appeared to have enhanced pHi recovery rates relative to primary hepatocytes.",False,Journal of Comparative Physiology B,False
121,10.1007/s00360-011-0574-2,https://www.semanticscholar.org/paper/f1f0905bc8772441df638e9cf5ab6f59331f4cb4,"Proteasomal activities in the claw muscle tissue of European lobster, Homarus gammarus, during larval development","Decapod crustaceans grow discontinuously and gain size through complex molt processes. The molt comprises the loss of the old cuticle and, moreover, substantial reduction and re-organization of muscles and connective tissues. In adult lobsters, the muscle tissue of the massive claws undergoes significant atrophy of 40–75% before ecdysis. The degradation of this tissue is facilitated by calcium-dependent proteases and by the proteasome, an intra-cellular proteolytic multi-enzyme complex. In contrast to the adults, the involvement of the proteasome during the larval development is yet not validated. Therefore, we developed micro-methods to measure the 20S and the 26S proteasomal activities within mg- and sub-mg-quantities of the larval claw tissue of the European lobster, Homarus gammarus. Within the three larval stages (Z1–3) we distinguished between sub-stages of freshly molted/hatched (post-molt), inter-molt, and ready to molt (pre-molt) larvae. Juveniles were analyzed in the post-molt and in the inter-molt stage. The trypsin-like, the chymotrypsin-like, and the peptidyl-glutamyl peptide hydrolase activity (PGPH) of the 20S proteasome increased distinctly from freshly hatched larvae to pre-molt Z1. During the Z2 stage, the activities were highest in the post-molt animals, decreased in the inter-molt animals and increased again in the pre-molt animals. A similar but less distinct trend was evident in the Z3 stages. In the juveniles, the proteasomal activities decreased toward the lowest values. A similar pattern was present for the chymotrypsin-like activity of the 26S proteasome. The results show that the proteasome plays a significant role during the larval development of lobsters. This is not only reflected by the elevated activities, but also by the continuous change of the trypsin/chymotrypsin-ratio which may indicate a shift in the subunit composition of the proteasome and, thus, a biochemical adjustment to better cope with elevated protein turnover rates during larval development.",True,Journal of Comparative Physiology B,False
122,10.1007/s00360-011-0578-y,https://www.semanticscholar.org/paper/88519b18092220d11fb433702308c3c23eba292a,Regulation of tail muscle arginine kinase by reversible phosphorylation in an anoxia-tolerant crayfish,"Freshwater crayfish, Orconectes virilis, can experience periodic exposures to hypoxia or anoxia due to low water flow (in summer) or ice cover (in winter) in their natural habitat. Hypoxia/anoxia disrupts energy metabolism and triggers mechanisms that to support ATP levels while often also suppressing ATP use. Arginine kinase (AK) (E.C. 2.7.3.3) is a crucial enzyme involved in energy metabolism in muscle, gating the use of phosphagen stores to buffer ATP levels. The present study investigated AK from tail muscle of O. virilis identifying changes to kinetic properties, phosphorylation state and structural stability between the enzyme from aerobic control and 20 h anoxic crayfish. Muscle AK from anoxia-exposed crayfish showed a significantly higher (by 59%) Km for l-arginine and a lower I50 value for urea than the aerobic form. Several lines of evidence indicated that AK was converted to a high phosphate form under anoxia: (a) aerobic and anoxic forms of AK showed well-separated elution peaks on DEAE ion exchange chromatography, (b) ProQ Diamond phosphoprotein staining showed a 64% higher bound phosphate content on anoxic AK compared with the aerobic form, and (c) treatment of anoxic AK with alkaline phosphatase reduced Kml-arginine to aerobic levels whereas incubation of aerobic AK with protein kinase A catalytic subunit raised the Km to anoxic levels. The physiological consequence of anoxia-induced AK phosphorylation may be to suppress AK activity in the phosphagen-synthesizing direction and, together with reduced cellular pH and ATP levels, promote the phosphagen-catabolizing direction under anoxic conditions. This is first time that AK has been shown to be regulated by reversible phosphorylation.",False,Journal of Comparative Physiology B,False
123,10.1007/s00360-011-0579-x,https://www.semanticscholar.org/paper/c506371ee8be18707d68f437d8c6aa7c4e3dcf04,Capacity for intracellular pH compensation during hypercapnia in white sturgeon primary liver cells,"Fish, exposed to elevated water CO2, experience a rapid elevation in blood CO2 (hypercapnia), resulting in acidification of both intra- and extra-cellular compartments. White sturgeon, Acipenser transmontanus, are exceptionally CO2 tolerant and can regulate tissue intracellular pH (pHi) in the presence of a pronounced hypercapnic acidosis (preferential pHi regulation). In this study, pHi regulatory capacity of sturgeon liver cells in primary culture was examined to assess the suitability of employing this in vitro system to understand in vivo CO2 tolerance in sturgeon. Using the pH-sensitive fluoroprobe BCECF, real-time changes in resting pHi and rates of pHi recovery were investigated during exposure to hypercapnia (3 and 6% CO2) in the absence and presence of additional acid loads induced by (20 mM) ammonium prepulse. During short-term (10 min) exposure to hypercapnia (3 and 6% CO2), sturgeon cells were acidified and no pHi compensation was observed. However, when exposure to 6% CO2 was extended to over 19 h, the CO2-induced intracellular acidosis was partially compensated by a pHi increase of over 0.2 pH unit despite the sustained extracellular acidosis, indicative of a capacity for preferential pHi regulation in vitro. Since this capacity in sturgeon liver is present both in vivo and in vitro, the transmembrane transporters involved may be the same. Therefore, cell culture may be a suitable tool to identify the transporters (i.e., the cellular mechanisms underlying in vivo CO2 tolerance) in white sturgeon and possibly in other hypercapnia-tolerant species.",False,Journal of Comparative Physiology B,False
124,10.1007/s00360-011-0576-0,https://www.semanticscholar.org/paper/de3498c32f3137683ed85df4992499fcca8df51b,Tests of the contribution of acclimation to geographic variation in water loss rates of the West Indian lizard Anolis cristatellus,"Phenotypic plasticity can contribute to the process of adaptive radiation by facilitating population persistence in novel environments. West Indian Anolis lizards provide a classic example of an adaptive radiation, in which divergence has occurred along two primary ecological axes: structural microhabitat and climate. Adaptive plasticity in limb morphology is hypothesized to have facilitated divergence along the structural niche axis in Anolis, but very little work has explored plasticity in physiological traits. Here, we experimentally ask whether Puerto Rican Anolis cristatellus from mesic and xeric habitats differ in desiccation rates, and whether these lizards exhibit an acclimation response to changes in relative humidity. We first present microclimatic data collected at lizard perch sites that demonstrate that abiotic conditions experienced by lizards differ between mesic and xeric habitat types. In Experiment 1, we measured desiccation rates of lizards from both habitats maintained under identical laboratory conditions. This experiment demonstrated that desiccation rates differ between populations; xeric lizards lose water more slowly than mesic lizards. In Experiment 2, lizards from each habitat were either maintained under the conditions of Experiment 1, or under extremely low relative humidity. Desiccation rates did not differ between lizards from the same habitat maintained under different treatments and xeric lizards maintained lower desiccation rates than mesic lizards within each treatment. Our results demonstrate that A. cristatellus does not exhibit an acclimation response to abrupt changes of hydric conditions, and suggest that tropical Anolis lizards might be unable to exhibit physiological plasticity in desiccation rates in response to varying climatic conditions.",False,Journal of Comparative Physiology B,False
125,10.1007/s00360-011-0577-z,https://www.semanticscholar.org/paper/cf2237f0ec0c7514a64e0288950a7ef3b1ff950e,"Cardiorespiratory responses to hypoxia in the African catfish, Clarias gariepinus (Burchell 1822), an air-breathing fish","The African catfish, Clarias gariepinus, possesses a pair of suprabranchial chambers located in the dorsal-posterior part of the branchial cavity having extensions from the upper parts of the second and fourth gill arches, forming the arborescent organs. This structure is an air-breathing organ (ABO) and allows aerial breathing (AB). We evaluated its cardiorespiratory responses to aquatic hypoxia. To determine the mode of air-breathing (obligate or accessory), fish had the respiratory frequency (fR) monitored and were subjected to normoxic water (PwO2 = 140 mmHg) without becoming hyperactive for 30 h. During this period, all fish survived without displaying evidences of hyperactivity and maintained unchanged fR, confirming that this species is a facultative air-breather. Its aquatic O2 uptake ($$ \dot{V}{\text{O}}_{2} $$) was maintained constant down to a critical PO2 (PcO2) of 60 mmHg, below which $$ \dot{V}{\text{O}}_{2} $$ declined linearly with further reductions of inspired O2 tension (PiO2). Just above the PcO2 the ventilatory tidal volume (VT) increased significantly along with gill ventilation ($$ \dot{V}_{\text{G}} $$), while fR changed little. Consequently, the water convection requirement $$ \left( {\dot{V}_{\text{G}} /\dot{V}{\text{O}}_{2} } \right) $$ increased steeply. This threshold applied to a cardiac response that included reflex bradycardia. AB was initiated at PiO2 = 140 mmHg (normoxia) and air-breathing episodes increased linearly with more severe hypoxia, being significantly higher at PiO2 tensions below the PcO2. Air-breathing episodes were accompanied by bradycardia pre air-breath, to tachycardia post air-breath.",False,Journal of Comparative Physiology B,False
126,10.1007/s00360-011-0580-4,https://www.semanticscholar.org/paper/207a31529793f4407f192fc3ef0460affb61b152,Seasonality of glycogen phosphorylase activity in crucian carp (Carassius carassius L.),"Seasonal changes in the activity of glycogen phosphorylase (GP), a rate-limiting enzyme of glycogen degradation, were examined in an anoxia-tolerant fish species, the crucian carp (Carassius carassius L.). In muscle and brain, the activity of GP remained constant throughout the year when tested at 25°C. In contrast, the activities of liver and heart GP displayed striking increases in summer. When seasonal temperature changes are taken into account, the activity of GP during the anoxic mid-winter is only 4–6% of its summer time activity in the muscle, heart and liver, and 13% in brain. In winter-acclimatized fish, experimental anoxia (1–6 weeks) caused sustained depression of the GP activity in heart and gills. In liver and muscle, a transient depression of GP activity occurred during the first week of anoxia but later GP activity recovered back to the normoxic level. GP of the brain was completely resistant to anoxia. In all studied tissues, the constitutive activity of GP is more than sufficient to degrade glycogen deposits during winter anoxia without anoxia-induced activation of GP. The seemingly paradoxical summer-time increase in the activity of liver and heart GP could be related to active life-style of the summer-acclimatized fish (growth, reproduction), the increased demand of energy and molecular precursors of anabolic metabolism being satisfied by preferential degradation of glycogen. The high glycogen content of winter-acclimatized crucian carp is not associated with the elevated GP activity or anoxic activation of GP.",False,Journal of Comparative Physiology B,False
127,10.1007/s00360-011-0575-1,https://www.semanticscholar.org/paper/e4401b11616042033649ec8e2db9940d3a1049d4,AMP-activated protein kinase plays a role in initiating metabolic rate suppression in goldfish hepatocytes,"In the present study, we test the hypothesis that AMP-activated protein kinase (AMPK) initiates metabolic rate suppression in isolated goldfish hepatocytes. To accomplish this, we attempted to pharmacologically activate AMPK in goldfish hepatocytes with 5-aminoimidazole-4-carboxamide ribonucleoside (AICAR) and the thienopyridone, A769662, to examine the effects of AMPK activation on eukaryotic elongation factor-2 (eEF2), protein synthesis, and cellular oxygen consumption rate ($$ \dot{M}_{{{\text{O}}_{ 2} }} $$). Goldfish hepatocytes treated with 1 mM AICAR under normoxic conditions (>200 μM O2) showed a modest but significant 1.1-fold increase in AMPK phosphorylation, a 7.5-fold increase in AMPK activity, a 1.4-fold increase in eEF2 phosphorylation, and a 24% decrease in $$ \dot{M}_{{{\text{O}}_{ 2} }} $$. At physiologically relevant [O2] (<40 μM O2), the addition of 1 mM AICAR resulted in only a 13% decrease in cellular $$ \dot{M}_{{{\text{O}}_{ 2} }} $$ with no change in sensitivity to [O2] as assessed by estimates of cellular P50 and P90 values. The addition of compound C, a general protein kinase inhibitor, after AICAR incubation did not reverse the effects of AICAR on $$ \dot{M}_{{{\text{O}}_{ 2} }} $$ in normoxia. Treatment of hepatocytes with ≤200 μM A769662 did not affect AMPK activity, AMPK phosphorylation, eEF2 phosphorylation, or cellular $$ \dot{M}_{{{\text{O}}_{ 2} }} $$. These data suggest that A769662 is not an activator of AMPK in goldfish hepatocytes. Although our study provides support for the hypothesis that AMPK plays a role in initiating metabolic rate suppression in goldfish hepatocytes, this support must be viewed cautiously because of the known off-target effects of the pharmacological agents used.",False,Journal of Comparative Physiology B,False
