,doi,url,title,abstract,is_open_access,journal_name,is_biomimicry
245,10.1007/s00360-010-0512-8,https://www.semanticscholar.org/paper/85f902804b84915753756b671febb4ad67e8fe16,Mechanisms of age-specific regulation of dopamine metabolism by juvenile hormone and 20-hydroxyecdysone in Drosophila females,"Abstract20-hydroxyecdysone (20E) and the juvenile hormone (JH) have an age-specific effect on total dopamine (DA) content in Drosophila (Gruntenko and Rauschenbach 2008). Earlier we studied the mechanism of influence of 20E and JH on DA metabolism in young females (Rauschenbach et al. in J Insect Physiol 53:587–591, 2007a: Arch Insect Biochem Physiol 65:95–102, 2008a; Gruntenko et al. in Arch Insect Biochem Physiol 72:263–269, 2009). Here we investigate the effects of 20E and JH on the activities of the alkaline phosphatase (ALP), tyrosine hydroxylase (TH) and DA-dependent arylalkylamine N-acetyltransferase (AANAT) in mature females of wild type D. virilis under normal conditions and under heat stress (38°C). 20E feeding of the flies led to a substantial decrease in ALP and TH activities and to an increase in AANAT activity in mature females. JH application resulted in an increasing of ALP and TH activities, but did not influence AANAT activity in mature females. A rise in JH and 20E levels was found to change ALP and TH stress reactivities. Mechanisms of age-specific regulation of DA level by 20E and JH in Drosophila females are discussed.",False,Journal of Comparative Physiology B,False
246,10.1007/s00360-010-0513-7,https://www.semanticscholar.org/paper/ebf82d81df0706c635cdbdccaff9b31b3d82d6e4,"The cranial arterio-venous temperature difference is related to respiratory evaporative heat loss in a panting species, the sheep (Ovis aries)","Panting is a mechanism that increases respiratory evaporative heat loss (REHL) under heat load. Because REHL uses body water, it is physiologically and ecologically relevant to know under what conditions free-ranging animals use panting. We investigated whether the cranial arterio-venous temperature difference could provide information about REHL. We exposed sheep to environments varying in ambient dry bulb temperatures (Env 1: ~15°C, Env 2: ~25°C, Env 3: ~40°C, Env 4: ~40°C + infrared radiation) and measured REHL simultaneously with carotid arterial (Tcar) and jugular venous (Tjug) blood temperatures, as well as brain (Tbrain) and rectal (Trec) temperatures. REHL increased significantly with ambient temperature, from 18.4 ± 4.5 W at Env 1 to 79.5 ± 12.6 W at Env 4 (P < 10−6). While there was no effect of environment on Tcar (P = 0.7) or Tjug (P = 0.09), the difference between them (Ta-v = Tcar − Tjug) increased from Env 1 to Env 2 (P = 0.04) and from Env 3 to Env 4 (P = 0.008). Ta-v reached a maximum of 0.7 ± 0.2°C at Env 4 and was positively correlated with REHL across environments (r2 = 0.78, F = 34.7, P < 10−3). Calculated cranial blood flow changed only from Env 2 to Env 3 (P = 0.002). The increase in REHL maintained homeothermy when dry heat loss decreased. While REHL could increase without generating an increase in Ta-v, any increase in Ta-v was always associated with an increase in REHL. We conclude that the cranial Ta-v provides useful information about REHL in panting animals.",False,Journal of Comparative Physiology B,False
247,10.1007/s00360-010-0515-5,https://www.semanticscholar.org/paper/60b93d7ce71b1efbd1bb591f9de64a61e6bb626d,"Erythrocyte permeability to urea and water: comparative study in rodents, ruminants, carnivores, humans, and birds","Mammalian erythrocytes exhibit high urea permeability (Purea) due to UT-B expression in their cytoplasmic membrane. This high Purea allows fast equilibration of urea in erythrocytes during their transit in the hyperosmotic renal medulla. It also allows more urea (in addition to that in plasma) to participate in counter-current exchange between ascending and descending vasa recta, thus improving the trapping of urea in the medulla and improving urine concentrating ability. To determine if Purea in erythrocytes is related to diet and urine concentrating ability, we measured Purea in erythrocytes from 11 different mammals and 5 birds using stopped-flow light scattering. Carnivores (dog, fox, cat) exhibited high Purea (in ×10−5 cm/s, 5.3 ± 0.6, 3.8 ± 0.5 and 2.8 ± 0.7, respectively). In contrast, herbivores (cow, donkey, sheep) showed much lower Purea (0.8 ± 0.2, 0.7 ± 0.2, 1.0 ± 0.1, respectively). Erythrocyte Purea in human (1.1 ± 0.2), and pig (1.5 ± 0.1), the two omnivores, was intermediate. Rodents and lagomorphs (mouse, rat, rabbit) had Purea intermediate between carnivores and omnivores (3.3 ± 0.4, 2.5 ± 0.3 and 2.4 ± 0.3, respectively). Birds that do not excrete urea and do not express UT-B in their erythrocytes had very low values (<0.1 × 10−5 cm/s). In contrast to Purea, water permeability, measured simultaneously, was relatively similar in all mammals. The species differences in erythrocytes Purea most probably reflect adaptation to the different types of diet and resulting different needs for concentrating urea in the urine.",False,Journal of Comparative Physiology B,False
248,10.1007/s00359-010-0589-2,https://www.semanticscholar.org/paper/dba99e24f41de0629f8fceae90eec3166203aa10,Fast and reliable decisions for a dynamic song parameter in field crickets,"We investigated the choice of female crickets for a dynamic song parameter (chirp rate) on a walking compensator, and the underlying neuronal basis for the choice in the form of discharge differences in the pair of AN1-neurons driving the phonotactic steering behaviour. Our analysis reveals that decisions about chirp rate in a choice situation are made fast and reliably by female crickets. They steered towards the higher chirp rate after a delay of only 2.2–6 s, depending on the rate difference between the song alternatives. In this time period, the female experienced only one to two additional chirps in the song model with the higher rate. There was a strong correlation between the accumulated AN1 discharge difference and the amount of steering towards the side with the stronger response.",True,Journal of Comparative Physiology A,False
249,10.1007/s00359-010-0587-4,https://www.semanticscholar.org/paper/d9041dd778a99c7d995eb5db52729e38dc57e0df,"Encoding of amplitude modulations by auditory neurons of the locust: influence of modulation frequency, rise time, and modulation depth","Using modulation transfer functions (MTF), we investigated how sound patterns are processed within the auditory pathway of grasshoppers. Spike rates of auditory receptors and primary-like local neurons did not depend on modulation frequencies while other local and ascending neurons had lowpass, bandpass or bandstop properties. Local neurons exhibited broader dynamic ranges of their rate MTF that extended to higher modulation frequencies than those of most ascending neurons. We found no indication that a filter bank for modulation frequencies may exist in grasshoppers as has been proposed for the auditory system of mammals. The filter properties of half of the neurons changed to an allpass type with a 50% reduction of modulation depths. Contrasting to reports for mammals, the sensitivity to small modulation depths was not enhanced at higher processing stages. In ascending neurons, a focus on the range of low modulation frequencies was visible in the temporal MTFs, which describe the temporal locking of spikes to the signal envelope. To investigate the influence of stimulus rise time, we used rectangularly modulated stimuli instead of sinusoidally modulated ones. Unexpectedly, steep stimulus onsets had only small influence on the shape of MTF curves of 70% of neurons in our sample.",True,Journal of Comparative Physiology A,False
250,10.1007/s00359-010-0569-6,https://www.semanticscholar.org/paper/6ee6df6e32b372df760ebffedb8f9369cfe6c8d2,Auditory fovea and Doppler shift compensation: adaptations for flutter detection in echolocating bats using CF-FM signals,"Rhythmical modulations in insect echoes caused by the moving wings of fluttering insects are behaviourally relevant information for bats emitting CF-FM signals with a high duty cycle. Transmitter and receiver of the echolocation system in flutter detecting foragers are especially adapted for the processing of flutter information. The adaptations of the transmitter are indicated by a flutter induced increase in duty cycle, and by Doppler shift compensation (DSC) that keeps the carrier frequency of the insect echoes near a reference frequency. An adaptation of the receiver is the auditory fovea on the basilar membrane, a highly expanded frequency representation centred to the reference frequency. The afferent projections from the fovea lead to foveal areas with an overrepresentation of sharply tuned neurons with best frequencies near the reference frequency throughout the entire auditory pathway. These foveal neurons are very sensitive to stimuli with natural and simulated flutter information. The frequency range of the foveal areas with their flutter processing neurons overlaps exactly with the frequency range where DS compensating bats most likely receive echoes from fluttering insects. This tight match indicates that auditory fovea and DSC are adaptations for the detection and evaluation of insects flying in clutter.",False,Journal of Comparative Physiology A,False
251,10.1007/s00359-010-0585-6,https://www.semanticscholar.org/paper/d8872010b87e427fb3a98799e6fea76c205a474e,Mechanisms of song production in the Australian magpie,"Australian magpies (Gymnorhina tibicen) are notable for their vocal prowess. We investigated the syringeal and respiratory dynamics of vocalization by two 6-month-old males, whose songs had a number of adult features. There was no strong lateral syringeal dominance and unilateral phonation was most often achieved by closing the syringeal valve on the contralateral side of the syrinx. Unlike other songbirds studied, magpies sometimes used an alternative syringeal motor pattern during unilateral phonation in which both sides of the syrinx are partially adducted and open to airflow. Also, in contrast to most other songbirds, the higher fundamental frequency during two-voice syllables was usually generated on the left side of the syrinx. Amplitude modulation, a prominent feature of magpie song, was produced by linear or nonlinear interactions between different frequencies which may originate either on opposite sides of the syrinx or on the same side. Pulse tones, similar to vocal fry in human speech, were present in some calls. Unlike small songbirds, the fundamental of the modal frequency can be as low as that of the pulse tone, suggesting that large birds may have evolved pulse tones to increase acoustic diversity, rather than decrease the fundamental frequency.",True,Journal of Comparative Physiology A,False
252,10.1007/s00359-010-0584-7,https://www.semanticscholar.org/paper/70c0c89316a82663e1cee0af0ccd4b1c6766ce25,Complex echo classification by echo-locating bats: a review,"Echo-locating bats constantly emit ultrasonic pulses and analyze the returning echoes to detect, localize, and classify objects in their surroundings. Echo classification is essential for bats’ everyday life; for instance, it enables bats to use acoustical landmarks for navigation and to recognize food sources from other objects. Most of the research of echo based object classification in echo-locating bats was done in the context of simple artificial objects. These objects might represent prey, flower, or fruit and are characterized by simple echoes with a single up to several reflectors. Bats, however, must also be able to use echoes that return from complex structures such as plants or other types of background. Such echoes are characterized by superpositions of many reflections that can only be described using a stochastic statistical approach. Scientists have only lately started to address the issue of complex echo classification by echo-locating bats. Some behavioral evidence showing that bats can classify complex echoes has been accumulated and several hypotheses have been suggested as to how they do so. Here, we present a first review of this data. We raise some hypotheses regarding possible interpretations of the data and point out necessary future directions that should be pursued.",False,Journal of Comparative Physiology A,False
253,10.1007/s00359-010-0576-7,https://www.semanticscholar.org/paper/b44246f30fdd34f7f54ef8cd2ab19dace9195e49,A pair of motion-sensitive neurons in the locust encode approaches of a looming object,"Neurons in the locust visual system encode approaches of looming stimuli and are implicated in production of escape behaviours. The lobula giant movement detector (LGMD) and its postsynaptic partner, the descending contralateral movement detector (DCMD) compute characteristics of expanding edges across the locust eye during a loom and DCMD synapses onto motor elements associated with behaviour. We identified another descending interneuron within the locust ventral nerve cord. We named this neuron the late DCMD (LDCMD) as it responds later during an approach, with the firing rate peaking at about the time of collision. LDCMD produced lower amplitude, broader action potentials that were associated with an afterhyperpolarization, whereas DCMD action potentials showed a brief afterhyperpolarization often followed by an afterdepolarization. Within the mesothoracic ganglion, the primary LDCMD axon located adjacent to the DCMD axon, was thinner and lacked collateral projections to the lateral region of the neuropil. When compared with DCMD, LDCMD fired with fewer spikes during a loom and showed weaker habituation to repeated approaches. Coincidence of LDCMD and DCMD firing increased during object approach. Our findings indicate the presence of an additional motion-sensitive descending neuron in the locust that encodes temporally distinct properties of an approaching object.",False,Journal of Comparative Physiology A,False
254,10.1007/s00359-010-0577-6,https://www.semanticscholar.org/paper/32b3d32eb4ecc486eafd7f25617c22f9afc41b64,"Acoustic-induced motion of the bushcricket (Mecopoda elongata, Tettigoniidae) tympanum","Bushcrickets have a tonotopically organised hearing organ, the so-called crista acustica, in the tibia of the forelegs. This organ responds to a frequency range of about 5–80 kHz and lies behind the anterior tympanum on top of a trachea branch. We analyzed the sound-induced vibration pattern of the anterior tympanum, using a Laser-Doppler-Vibrometer Scanning microscope system, in order to identify frequency-dependent amplitude and phase of displacement. The vibration pattern evoked by a frequency sweep (4–79 kHz) showed an amplitude maximum which would correspond to the resonance frequency of an open tube system. At higher frequencies of about 30 kHz a difference in the amplitude and phase response between the distal and the proximal part of the tympanum was detected. The inner plate of the tympanum starts to wobble at this frequency. This higher mode in the motion pattern is not explained by purely acoustic characteristics of the tracheal space below the tympanum but may depend on the mechanical impedance of the tympanum plate. In accordance with a previous hypothesis, the tympanum moves over the whole tested frequency range in the dorso-ventral direction like a hinged flap with the largest displacement in its ventral part and no higher modes of vibration.",False,Journal of Comparative Physiology A,False
255,10.1007/s00359-010-0581-x,https://www.semanticscholar.org/paper/59e0a9dbccf0521dcefdde07a5acc8b05c03a257,Serotonergic cerebral cells control activity of cilia in the foregut of the pteropod mollusk Clione limacina,"Bilaterally symmetrical pair of serotonergic cells, named C1 in Clione, has been described in the cerebral ganglia of all gastropod species. Here we describe a new role of C1 cells in gastropod mollusks: control of activity of ciliated epithelium in the foregut. Detailed morphological investigation of C1 neurons in the pteropod mollusk Clionelimacina revealed that these cells among other destinations send their neurites into foregut where they produce intense arborization with large varicosities along the processes. Intracellular stimulation of a single C1 induced pronounced activation (often followed by inhibition) of cilia lining the foregut. This activation was substantially reduced by serotonin antagonist mianserin. Bath application of serotonin also induced transient increase in ciliary transport rate, followed by inhibition of ciliary activity up to its full cessation in some areas of isolated foregut. These data suggest that C1 in Clione may use serotonin to influence cilia in the foregut. Taking into account high homology of serotonergic cerebral cells across studied species we can speculate that these cells may be involved in the neural control of cilia in the foregut in other gastropod mollusks.",False,Journal of Comparative Physiology A,False
256,10.1007/s00359-010-0583-8,https://www.semanticscholar.org/paper/fd5e448007f20ddb14b77c2d758028aa8a6f924a,Comparative biology of pheromonal communication in vertebrates. Editorial.,,False,"Journal of comparative physiology. A, Neuroethology, sensory, neural, and behavioral physiology",False
257,10.1007/s00359-010-0579-4,https://www.semanticscholar.org/paper/0be7998a518f462d906e17be40e27c49fdab73f9,"Differential effects of testosterone, dihydrotestosterone and estradiol on carotenoid deposition in an avian sexually selected signal","Recent studies have demonstrated that carotenoid-based traits are under the control of testosterone (T) by up-regulation of carotenoid carriers (lipoproteins) and/or tissue-specific uptake of carotenoids. T can be converted to dihydrotestosterone (DHT) and estradiol (E2), and variation in conversion rate may partly explain some contradictory findings in the literature. Moreover, most studies on the effect of T on sexual signals have focused on the male sex only, while in many species females show the same signal, albeit to a lesser extent. We studied the effects of T, DHT, and E2 treatment in male and female diamond doves Geopelia cuneata in which both sexes have an enlarged red eye ring, which is more pronounced in males. We first showed that this periorbital ring contains very high concentration of carotenoids, of which most are lutein esters. Both T and DHT were effective in enhancing hue, UV-chroma and size in both sexes, while E2 was ineffective. However, E2 dramatically increased the concentration of circulating lipoproteins. We conclude that in both sexes both color and size of the secondary sexual trait are androgen dependent. The action of androgens is independent of lipoproteins regulation. Potential mechanisms and their consequences for trade-off are discussed.",True,Journal of Comparative Physiology A,False
258,10.1007/s00359-010-0575-8,https://www.semanticscholar.org/paper/86bb96bd115fe8d8730bb869412af154d6e3daff,Vision as a third sensory modality to elicit attack behavior in a nocturnal spider,"Cupiennius salei (Ctenidae) has been extensively studied for many years and is probably the only spider that presently can be considered a model organism for neuro-ethology. The night-active spiders have been shown to predominantly rely on their excellent mechano-sensory systems for courtship and prey capture, whereas vision was assumed to play a minor role, if any, in these behavioral contexts. Using slowly moving discs presented on a computer screen it could be shown for the first time that visual stimuli alone can elicit attack behavior (abrupt approaching reactions) in these spiders as well. These observations suggest that visual information could be used by the spiders to elicit and guide predatory behavior. Attack behavior in Cupiennius salei can thus be triggered independently by three sensory modalities—substrate vibrations, airflow stimuli, and visual cues—and offers an interesting model system to study the interactions of multimodal sensory channels in complex behavior.",False,Journal of Comparative Physiology A,False
259,10.1007/s00359-010-0578-5,https://www.semanticscholar.org/paper/ecb8bad861d5c8344ee9b2d0587c4f788f82c52a,"Antennae in the hawkmoth Manduca sexta (Lepidoptera, Sphingidae) mediate abdominal flexion in response to mechanical stimuli","Flying insects rely on the integration of feedback signals from multiple sensory modalities. Thus, in addition to the visual input, mechanosensory information from antennae is crucial for stable flight in the hawkmoth Manduca sexta. However, the nature of compensatory reflexes mediated by mechanoreceptors on the antennae is unknown. In this study we describe an abdominal flexion response mediated by the antennal mechanosensory input during mechanical body rotations. Such reflexive abdominal motions lead to shifts in the animal’s center of mass, and therefore changes in flight trajectory. Moths respond with abdominal flexion both to visual and mechanical rotations, but the mechanical response depends on the presence of the mass of the flagellum. In addition, the mechanically mediated flexion response is about 200° out of phase with the visual response and adds linearly to it. Phase-shifting feedback signals in such a manner can lead to a more stable behavioral output response when the animal is faced with turbulent perturbations to the flight path.",False,Journal of Comparative Physiology A,False
260,10.1007/s00359-010-0580-y,https://www.semanticscholar.org/paper/7de61803ab085bca4643cae6f95e87b9b62850ac,Olfactory sensitivity for sperm-attractant aromatic aldehydes: a comparative study in human subjects and spider monkeys,"Using a three-alternative forced-choice ascending staircase procedure, we determined olfactory detection thresholds in 20 human subjects for seven aromatic aldehydes and compared them to those of four spider monkeys tested in parallel using an operant conditioning paradigm. With all seven odorants, both species detected concentrations <1 ppm, and with several odorants single individuals of both species even discriminated concentrations <1 ppb from the solvent. No generalizable species differences in olfactory sensitivity were found despite marked differences in neuroanatomical and genetic features. The across-odorant patterns of sensitivity correlated significantly between humans and spider monkeys, and both species were more sensitive to bourgeonal than to lilial, cyclamal, canthoxal, helional, lyral, and 3-phenylpropanal. No significant correlation between presence/absence of an oxygen-containing moiety attached to the benzene ring or presence/absence of an additional alkyl group next to the functional aldehyde group, and olfactory sensitivity was found in any of the species. However, the presence of a tertiary butyl group in para position (relative to the functional aldehyde group) combined with a lack of an additional alkyl group next to the functional aldehyde group may be responsible for the finding that both species were most sensitive to bourgeonal.",False,Journal of Comparative Physiology A,False
261,10.1007/s00359-010-0582-9,https://www.semanticscholar.org/paper/a1055af75c223d2874dae0c6f2a767ccc4a31adf,"Biophysical costs associated with tetrodotoxin resistance in the sodium channel pore of the garter snake, Thamnophis sirtalis","Tetrodotoxin (TTX) is a potent toxin that specifically binds to voltage-gated sodium channels (NaV). TTX binding physically blocks the flow of sodium ions through NaV, thereby preventing action potential generation and propagation. TTX has different binding affinities for different NaV isoforms. These differences are imparted by amino acid substitutions in positions within, or proximal to, the TTX-binding site in the channel pore. These substitutions confer TTX-resistance to a variety of species. The garter snake Thamnophis sirtalis has evolved TTX-resistance over the course of an arms race, allowing some populations of snakes to feed on tetrodotoxic newts, including Taricha granulosa. Different populations of the garter snake have different degrees of TTX-resistance, which is closely related to the number of amino acid substitutions. We tested the biophysical properties and ion selectivity of NaV of three garter snake populations from Bear Lake, Idaho; Warrenton, Oregon; and Willow Creek, California. We observed changes in gating properties of TTX-resistant (TTXr) NaV. In addition, ion selectivity of TTXr NaV was significantly different from that of TTX-sensitive NaV. These results suggest TTX-resistance comes at a cost to performance caused by changes in the biophysical properties and ion selectivity of TTXr NaV.",False,Journal of Comparative Physiology A,False
