,doi,url,title,abstract,is_open_access,journal_name,is_biomimicry
360,10.1016/j.cell.2018.05.051,https://www.semanticscholar.org/paper/edf45ca95ffc8bdc3dc056371bcde32aa8995d8c,Common Disease Is More Complex Than Implied by the Core Gene Omnigenic Model,"The evidence that most adult-onset common diseases have a polygenic genetic architecture fully consistent with robust biological systems supported by multiple back-up mechanisms is now overwhelming. In this context, we consider the recent ""omnigenic"" or ""core genes"" model. A key assumption of the model is that there is a relatively small number of core genes relevant to any disease. While intuitively appealing, this model may underestimate the biological complexity of common disease, and therefore, the goal to discover core genes should not guide experimental design. We consider other implications of polygenicity, concluding that a focus on patient stratification is needed to achieve the goals of precision medicine.",True,Cell,False
361,10.1016/j.cell.2018.05.044,https://www.semanticscholar.org/paper/74227a98336477dbcb3ee02b988662d054c0460c,Sunlight Brightens Learning and Memory,"Sunlight can alter mood, behavior, and cognition, but the cellular basis of this phenomenon remains to be fully elucidated. In this issue of Cell, Zhu et al. shed light on a UV-dependent metabolic pathway that leads to increased synaptic release of glutamate and enhanced motor learning and memory in mice.",True,Cell,False
362,10.1016/j.cell.2018.05.053,https://www.semanticscholar.org/paper/161dad29d439422c0ecaaf2458f46dc736012f22,Disease Heritability Studies Harness the Healthcare System to Achieve Massive Scale,Heritability studies are essential for defining genetic influences on disease risk and trait variability. Polubriaginof et al. show how massive amounts of data contained in electronic health records can be used for heritability studies on hundreds of phenotypes. Mining emergency contact information with comparison to existing gold standards showcases the broad utility of the approach.,True,Cell,False
363,10.1016/j.cell.2018.05.062,https://www.semanticscholar.org/paper/6570f184a63cb49df31e14a00fea929844003a8f,Prospecting for Planarian Pluripotency,"Planarians are renowned for extraordinary regenerative abilities that are driven by stem cells maintained throughout their lives. In this issue of Cell, Zeng et al. report the prospective isolation of planarian pluripotent stem cells. Their work opens new directions for understanding how these remarkable cells are established, maintained, and activated.",True,Cell,False
364,10.1016/j.cell.2018.05.056,https://www.semanticscholar.org/paper/2dc18f661b400033abd1086b917c451d3358aef2,Visible Machine Learning for Biomedicine,"A major ambition of artificial intelligence lies in translating patient data to successful therapies. Machine learning models face particular challenges in biomedicine, however, including handling of extreme data heterogeneity and lack of mechanistic insight into predictions. Here, we argue for ""visible"" approaches that guide model structure with experimental biology.",True,Cell,False
365,10.1016/j.cell.2018.05.055,https://www.semanticscholar.org/paper/0f658c0d53739d0a1a556fe6ea8be2a9f6f699ff,CRISPR Inspirations,,True,Cell,False
366,10.1016/j.cell.2018.05.054,https://www.semanticscholar.org/paper/ce9f0a54effa9e2ba9a19c068c2388a72ff47d5d,The Ongoing Shakeup in Organelle Biology,"With the complexities of organelle communication and their dynamics under intense investigation, what are the new principles that are emerging, and where is the field headed? Cell's Robert Kruger recently discussed these questions with Erika Holzbaur, Jennifer Lippincott-Schwartz, and Ivan Dikic. Annotated excerpts from this conversation are presented below, and the full conversation is available with the article online.",True,Cell,False
367,10.1016/j.cell.2018.05.049,https://www.semanticscholar.org/paper/438891ae6f8bd89725731a46317b1102fe20d975,New Flavors in Immunomodulation,"Whether to boost the immune system or to tame it, drugs that modulate immune function are becoming an essential part of modern pharmacopoeia. While many of these target molecules that are expressed by immune cells, recent advances in immunometabolism are now opening new classes of modulators that derive from endogenous metabolites. It is becoming clear that the immune system is involved in many diseases, including conditions that were not traditionally considered infectious, inflammatory, or autoimmune, such as cancer and cardiovascular diseases. In that context, immunomodulation is now a critical part of the pharmaceutic arsenal, either for the potentiation of immune responses, with anti-PD-1 or anti-CTLA-4 as obvious examples, or to limit them, with anti-tumor necrosis factors (TNFs) leading drug sales for the last few years. By and large, research in this area has been focused on blocking immune cytokines and receptors either through antibodies or kinase inhibitors. Now, with two recent studies reporting the use of modified metabolites to suppress immune responses (Kornberg et al., 2018; Mills et al., 2018), immunometabolism is opening a new front in the quest to modulate immune function. Indeed, the current approaches have shown extraordinary success, but they have also sometimes been limited by the redundancy of immune activators and inhibitors. For example, immune exhaustion in cancer is mediated by a large variety of soluble and cell-surface molecules, and despite the success of anti-PD-1 as a single agent, many other receptors might need to be blocked simultaneously to improve therapeutic efficiency further and overcome resistance (Sharma et al., 2017). In addition to immune mediators, the function of immune cells is also modulated by all core pathways for cellular function, and metabolism has emerged as a critical hub in their activation. This line of inquiry started with the observa-",True,Cell,False
368,10.1016/j.cell.2018.05.035,https://www.semanticscholar.org/paper/b4a6af7e5102cd519ba16de4c4a3fe3ac9ea8b37,Dynamics and Spatial Genomics of the Nascent Transcriptome by Intron seqFISH,"Visualization of the transcriptome and the nuclear organization in situ has been challenging for single-cell analysis. Here, we demonstrate a multiplexed single-molecule in situ method, intron seqFISH, that allows imaging of 10,421 genes at their nascent transcription active sites in single cells, followed by mRNA and lncRNA seqFISH and immunofluorescence. This nascent transcriptome-profiling method can identify different cell types and states with mouse embryonic stem cells and fibroblasts. The nascent sites of RNA synthesis tend to be localized on the surfaces of chromosome territories, and their organization in individual cells is highly variable. Surprisingly, the global nascent transcription oscillated asynchronously in individual cells with a period of 2 hr in mouse embryonic stem cells, as well as in fibroblasts. Together, spatial genomics of the nascent transcriptome by intron seqFISH reveals nuclear organizational principles and fast dynamics in single cells that are otherwise obscured.",True,Cell,False
369,10.1016/j.cell.2018.05.020,https://www.semanticscholar.org/paper/c3bc7190299a85b38d5f63bbd77d30e7790be93f,A Flat BAR Protein Promotes Actin Polymerization at the Base of Clathrin-Coated Pits,"Summary Multiple proteins act co-operatively in mammalian clathrin-mediated endocytosis (CME) to generate endocytic vesicles from the plasma membrane. The principles controlling the activation and organization of the actin cytoskeleton during mammalian CME are, however, not fully understood. Here, we show that the protein FCHSD2 is a major activator of actin polymerization during CME. FCHSD2 deletion leads to decreased ligand uptake caused by slowed pit maturation. FCHSD2 is recruited to endocytic pits by the scaffold protein intersectin via an unusual SH3-SH3 interaction. Here, its flat F-BAR domain binds to the planar region of the plasma membrane surrounding the developing pit forming an annulus. When bound to the membrane, FCHSD2 activates actin polymerization by a mechanism that combines oligomerization and recruitment of N-WASP to PI(4,5)P2, thus promoting pit maturation. Our data therefore describe a molecular mechanism for linking spatiotemporally the plasma membrane to a force-generating actin platform guiding endocytic vesicle maturation.",True,Cell,False
370,10.1016/j.cell.2018.05.022,https://www.semanticscholar.org/paper/c782490699783fc6a914b8d82e409a23fc67f3b5,A Network of Noncoding Regulatory RNAs Acts in the Mammalian Brain,"Noncoding RNAs (ncRNAs) play increasingly appreciated gene-regulatory roles. Here, we describe a regulatory network centered on four ncRNAs-a long ncRNA, a circular RNA, and two microRNAs-using gene editing in mice to probe the molecular consequences of disrupting key components of this network. The long ncRNA Cyrano uses an extensively paired site to miR-7 to trigger destruction of this microRNA. Cyrano-directed miR-7 degradation is much more effective than previously described examples of target-directed microRNA degradation, which come primarily from studies of artificial and viral RNAs. By reducing miR-7 levels, Cyrano prevents repression of miR-7-targeted mRNAs and enables accumulation of Cdr1as, a circular RNA known to regulate neuronal activity. Without Cyrano, excess miR-7 causes cytoplasmic destruction of Cdr1as in neurons, in part through enhanced slicing of Cdr1as by a second miRNA, miR-671. Thus, several types of ncRNAs can collaborate to establish a sophisticated regulatory network.",True,Cell,False
371,10.1016/j.cell.2018.05.015,https://www.semanticscholar.org/paper/d2c12b2e57d1262a3c8beb119bbadf596d7a116a,Next-Generation Machine Learning for Biological Networks,"Machine learning, a collection of data-analytical techniques aimed at building predictive models from multi-dimensional datasets, is becoming integral to modern biological research. By enabling one to generate models that learn from large datasets and make predictions on likely outcomes, machine learning can be used to study complex cellular systems such as biological networks. Here, we provide a primer on machine learning for life scientists, including an introduction to deep learning. We discuss opportunities and challenges at the intersection of machine learning and network biology, which could impact disease biology, drug discovery, microbiome research, and synthetic biology.",True,Cell,False
372,10.1016/j.cell.2018.05.024,https://www.semanticscholar.org/paper/4bf741f2af47e1868a5c4f5470ba83ae28e43a21,Higher-Order Inter-chromosomal Hubs Shape 3D Genome Organization in the Nucleus,"Eukaryotic genomes are packaged into a 3-dimensional structure in the nucleus. Current methods for studying genome-wide structure are based on proximity ligation. However, this approach can fail to detect known structures, such as interactions with nuclear bodies, because these DNA regions can be too far apart to directly ligate. Accordingly, our overall understanding of genome organization remains incomplete. Here, we develop split-pool recognition of interactions by tag extension (SPRITE), a method that enables genome-wide detection of higher-order interactions within the nucleus. Using SPRITE, we recapitulate known structures identified by proximity ligation and identify additional interactions occurring across larger distances, including two hubs of inter-chromosomal interactions that are arranged around the nucleolus and nuclear speckles. We show that a substantial fraction of the genome exhibits preferential organization relative to these nuclear bodies. Our results generate a global model whereby nuclear bodies act as inter-chromosomal hubs that shape the overall packaging of DNA in the nucleus.",True,Cell,False
373,10.1016/j.cell.2018.05.017,https://www.semanticscholar.org/paper/921078d9b6778a0d098392b37a4a3d57a2bb179c,Structural Basis for Transcript Elongation Control by NusG Family Universal Regulators,"NusG/RfaH/Spt5 transcription elongation factors are the only transcription regulators conserved across all life. Bacterial NusG regulates RNA polymerase (RNAP) elongation complexes (ECs) across most genes, enhancing elongation by suppressing RNAP backtracking and coordinating ρ-dependent termination and translation. The NusG paralog RfaH engages the EC only at operon polarity suppressor (ops) sites and suppresses both backtrack and hairpin-stabilized pausing. We used single-particle cryoelectron microscopy (cryo-EM) to determine structures of ECs at ops with NusG or RfaH. Both factors chaperone base-pairing of the upstream duplex DNA to suppress backtracking, explaining stimulation of elongation genome-wide. The RfaH-opsEC structure reveals how RfaH confers operon specificity through specific recognition of an ops hairpin in the single-stranded nontemplate DNA and tighter binding to the EC to exclude NusG. Tight EC binding by RfaH sterically blocks the swiveled RNAP conformation necessary for hairpin-stabilized pausing. The universal conservation of NusG/RfaH/Spt5 suggests that the molecular mechanisms uncovered here are widespread.",True,Cell,False
374,10.1016/j.cell.2018.05.007,https://www.semanticscholar.org/paper/ba7e2da8998fdebd54fac2bb581fe0968637caf1,SMCHD1 Merges Chromosome Compartments and Assists Formation of Super-Structures on the Inactive X,"Mammalian chromosomes are partitioned into A/B compartments and topologically associated domains (TADs). The inactive X (Xi) chromosome, however, adopts a distinct conformation without evident compartments or TADs. Here, through exploration of an architectural protein, structural-maintenance-of-chromosomes hinge domain containing 1 (SMCHD1), we probe how the Xi is reconfigured during X chromosome inactivation. A/B compartments are first fused into ""S1"" and ""S2"" compartments, coinciding with Xist spreading into gene-rich domains. SMCHD1 then binds S1/S2 compartments and merges them to create a compartment-less architecture. Contrary to current views, TADs remain on the Xi but in an attenuated state. Ablating SMCHD1 results in a persistent S1/S2 organization and strengthening of TADs. Furthermore, loss of SMCHD1 causes regional defects in Xist spreading and erosion of heterochromatic silencing. We present a stepwise model for Xi folding, where SMCHD1 attenuates a hidden layer of Xi architecture to facilitate Xist spreading.",True,Cell,False
375,10.1016/j.cell.2018.05.004,https://www.semanticscholar.org/paper/af3e2d6249578bdc9e76169adb89c508a895ae80,"TCR Transgenic Mice Reveal Stepwise, Multi-site Acquisition of the Distinctive Fat-Treg Phenotype","Visceral adipose tissue (VAT) hosts a population of regulatory T (Treg) cells, with a unique phenotype, that controls local and systemic inflammation and metabolism. Generation of a T cell receptor transgenic mouse line, wherein VAT Tregs are highly enriched, facilitated study of their provenance, dependencies, and activities. We definitively established a role for T cell receptor specificity, uncovered an unexpected function for the primordial Treg transcription-factor, Foxp3, evidenced a cell-intrinsic role for interleukin-33 receptor, and ordered these dependencies within a coherent scenario. Genesis of the VAT-Treg phenotype entailed a priming step in the spleen, permitting them to exit the lymphoid organs and surveil nonlymphoid tissues, and a final diversification process within VAT, in response to microenvironmental cues. Understanding the principles of tissue-Treg biology is a prerequisite for precision-targeting strategies.",True,Cell,False
376,10.1016/j.cell.2018.05.014,https://www.semanticscholar.org/paper/1eeb2044d11ac22f85f4f4395aa8dccf84a0fda0,A Metabolite-Triggered Tuft Cell-ILC2 Circuit Drives Small Intestinal Remodeling,"The small intestinal tuft cell-ILC2 circuit mediates epithelial responses to intestinal helminths and protists by tuft cell chemosensory-like sensing and IL-25-mediated activation of lamina propria ILC2s. Small intestine ILC2s constitutively express the IL-25 receptor, which is negatively regulated by A20 (Tnfaip3). A20 deficiency in ILC2s spontaneously triggers the circuit and, unexpectedly, promotes adaptive small-intestinal lengthening and remodeling. Circuit activation occurs upon weaning and is enabled by dietary polysaccharides that render mice permissive for Tritrichomonas colonization, resulting in luminal accumulation of acetate and succinate, metabolites of the protist hydrogenosome. Tuft cells express GPR91, the succinate receptor, and dietary succinate, but not acetate, activates ILC2s via a tuft-, TRPM5-, and IL-25-dependent pathway. Also induced by parasitic helminths, circuit activation and small intestinal remodeling impairs infestation by new helminths, consistent with the phenomenon of concomitant immunity. We describe a metabolic sensing circuit that may have evolved to facilitate mutualistic responses to luminal pathosymbionts.",True,Cell,False
377,10.1016/j.cell.2018.05.009,https://www.semanticscholar.org/paper/7c2234dbbd207658f92bcde97e1180c74a0cd9f6,Acid Suspends the Circadian Clock in Hypoxia through Inhibition of mTOR,"Recent reports indicate that hypoxia influences the circadian clock through the transcriptional activities of hypoxia-inducible factors (HIFs) at clock genes. Unexpectedly, we uncover a profound disruption of the circadian clock and diurnal transcriptome when hypoxic cells are permitted to acidify to recapitulate the tumor microenvironment. Buffering against acidification or inhibiting lactic acid production fully rescues circadian oscillation. Acidification of several human and murine cell lines, as well as primary murine T cells, suppresses mechanistic target of rapamycin complex 1 (mTORC1) signaling, a key regulator of translation in response to metabolic status. We find that acid drives peripheral redistribution of normally perinuclear lysosomes away from perinuclear RHEB, thereby inhibiting the activity of lysosome-bound mTOR. Restoring mTORC1 signaling and the translation it governs rescues clock oscillation. Our findings thus reveal a model in which acid produced during the cellular metabolic response to hypoxia suppresses the circadian clock through diminished translation of clock constituents.",True,Cell,False
378,10.1016/j.cell.2018.05.032,https://www.semanticscholar.org/paper/6805b4420a722fd86b3e3b9044b68c45d78e1652,SnapShot: Functions of Tubulin Posttranslational Modifications,"Post-translational modification of tubulin offers a mechanism for functional diversification of microtubules and regulation in a variety of physiological contexts. This SnapShot recaps the current state of understanding of tubulin posttranslational modifications and their functions in the regulation of biological processes. To view this SnapShot, open or download the PDF.",False,Cell,False
379,10.1016/j.cell.2018.05.031,https://www.semanticscholar.org/paper/e6513d710ff283f3ceb1db5bef9be5454e63d01f,Cryo-EM Structure of Human Dicer and Its Complexes with a Pre-miRNA Substrate,"Livia Garzia, Noriyuki Kijima, A. Sorana Morrissy, Pasqualino De Antonellis, Ana Guerreiro-Stucklin, Borja L. Holgado, Xiaochong Wu, Xin Wang, Michael Parsons, Kory Zayne, Alex Manno, Claudia Kuzan-Fischer, Carolina Nor, Laura K. Donovan, Jessica Liu, Lei Qin, Alexandra Garancher, Kun-Wei Liu, Sheila Mansouri, Betty Luu, Yuan Yao Thompson, Vijay Ramaswamy, John Peacock, Hamza Farooq, Patryk Skowron, David J.H. Shih, Angela Li, Sherine Ensan, Clinton S. Robbins, Myron Cybulsky, Siddhartha Mitra, Yussanne Ma, Richard Moore, Andy Mungall, Yoon-Jae Cho, William A. Weiss, Jennifer A. Chan, Cynthia E. Hawkins, Maura Massimino, Nada Jabado, Michal Zapotocky, David Sumerauer, Eric Bouffet, Peter Dirks, Uri Tabori, Poul H.B. Sorensen, Priscilla K. Brastianos, Kenneth Aldape, Steven J.M. Jones, Marco A. Marra, James R. Woodgett, Robert J. Wechsler-Reya, Daniel W. Fults, and Michael D. Taylor* *Correspondence: mdtaylor@sickkids.ca https://doi.org/10.1016/j.cell.2018.05.033",True,Cell,False
380,10.1016/j.cell.2018.05.033,https://www.semanticscholar.org/paper/de01a4d97f9c5f275a0d13b4f0d97304832f15fa,A Hematogenous Route for Medulloblastoma Leptomeningeal Metastases,"Livia Garzia, Noriyuki Kijima, A. Sorana Morrissy, Pasqualino De Antonellis, Ana Guerreiro-Stucklin, Borja L. Holgado, Xiaochong Wu, Xin Wang, Michael Parsons, Kory Zayne, Alex Manno, Claudia Kuzan-Fischer, Carolina Nor, Laura K. Donovan, Jessica Liu, Lei Qin, Alexandra Garancher, Kun-Wei Liu, Sheila Mansouri, Betty Luu, Yuan Yao Thompson, Vijay Ramaswamy, John Peacock, Hamza Farooq, Patryk Skowron, David J.H. Shih, Angela Li, Sherine Ensan, Clinton S. Robbins, Myron Cybulsky, Siddhartha Mitra, Yussanne Ma, Richard Moore, Andy Mungall, Yoon-Jae Cho, William A. Weiss, Jennifer A. Chan, Cynthia E. Hawkins, Maura Massimino, Nada Jabado, Michal Zapotocky, David Sumerauer, Eric Bouffet, Peter Dirks, Uri Tabori, Poul H.B. Sorensen, Priscilla K. Brastianos, Kenneth Aldape, Steven J.M. Jones, Marco A. Marra, James R. Woodgett, Robert J. Wechsler-Reya, Daniel W. Fults, and Michael D. Taylor* *Correspondence: mdtaylor@sickkids.ca https://doi.org/10.1016/j.cell.2018.05.033",True,Cell,False
381,10.1016/j.cell.2018.05.019,https://www.semanticscholar.org/paper/b037c5fbc9fbf959c7a62aca33efed5eeb303389,Cnidarian Cell Type Diversity and Regulation Revealed by Whole-Organism Single-Cell RNA-Seq,"The emergence and diversification of cell types is a leading factor in animal evolution. So far, systematic characterization of the gene regulatory programs associated with cell type specificity was limited to few cell types and few species. Here, we perform whole-organism single-cell transcriptomics to map adult and larval cell types in the cnidarian Nematostella vectensis, a non-bilaterian animal with complex tissue-level body-plan organization. We uncover eight broad cell classes in Nematostella, including neurons, cnidocytes, and digestive cells. Each class comprises different subtypes defined by the expression of multiple specific markers. In particular, we characterize a surprisingly diverse repertoire of neurons, which comparative analysis suggests are the result of lineage-specific diversification. By integrating transcription factor expression, chromatin profiling, and sequence motif analysis, we identify the regulatory codes that underlie Nematostella cell-specific expression. Our study reveals cnidarian cell type complexity and provides insights into the evolution of animal cell-specific genomic regulation.",True,Cell,False
382,10.1016/j.cell.2018.05.013,https://www.semanticscholar.org/paper/198537757536a8f3fcdd551c0229973157799a16,Genetic Inactivation of CD33 in Hematopoietic Stem Cells to Enable CAR T Cell Immunotherapy for Acute Myeloid Leukemia,"The absence of cancer-restricted surface markers is a major impediment to antigen-specific immunotherapy using chimeric antigen receptor (CAR) T cells. For example, targeting the canonical myeloid marker CD33 in acute myeloid leukemia (AML) results in toxicity from destruction of normal myeloid cells. We hypothesized that a leukemia-specific antigen could be created by deleting CD33 from normal hematopoietic stem and progenitor cells (HSPCs), thereby generating a hematopoietic system resistant to CD33-targeted therapy and enabling specific targeting of AML with CAR T cells. We generated CD33-deficient human HSPCs and demonstrated normal engraftment and differentiation in immunodeficient mice. Autologous CD33 KO HSPC transplantation in rhesus macaques demonstrated long-term multilineage engraftment of gene-edited cells with normal myeloid function. CD33-deficient cells were impervious to CD33-targeting CAR T cells, allowing for efficient elimination of leukemia without myelotoxicity. These studies illuminate a novel approach to antigen-specific immunotherapy by genetically engineering the host to avoid on-target, off-tumor toxicity.",True,Cell,False
383,10.1016/j.cell.2018.03.067,https://www.semanticscholar.org/paper/02d708c00b85dcef62e4a7d7e9db23fff972c3ad,Human-Specific NOTCH2NL Genes Expand Cortical Neurogenesis through Delta/Notch Regulation,"Summary The cerebral cortex underwent rapid expansion and increased complexity during recent hominid evolution. Gene duplications constitute a major evolutionary force, but their impact on human brain development remains unclear. Using tailored RNA sequencing (RNA-seq), we profiled the spatial and temporal expression of hominid-specific duplicated (HS) genes in the human fetal cortex and identified a repertoire of 35 HS genes displaying robust and dynamic patterns during cortical neurogenesis. Among them NOTCH2NL, human-specific paralogs of the NOTCH2 receptor, stood out for their ability to promote cortical progenitor maintenance. NOTCH2NL promote the clonal expansion of human cortical progenitors, ultimately leading to higher neuronal output. At the molecular level, NOTCH2NL function by activating the Notch pathway through inhibition of cis Delta/Notch interactions. Our study uncovers a large repertoire of recently evolved genes active during human corticogenesis and reveals how human-specific NOTCH paralogs may have contributed to the expansion of the human cortex.",True,Cell,False
